4,10,005,0001,0034,100007,01,1,1,01,07, 5,311,ARQUITECTURA,3,2,2,2,1,2,24,2,,,2,1,1,,1,COORDINACION DE CARRERA DE ARQUITECTURA A LOS MAESTROS,21,DIRECTOR DE LA CLASE DE ARQUITECTURA,ESCUELA PRIVADA UNIVERSIDAD AUTONOMA DE DURANGO,61,IMPARTIR EDUCACION A NIVER SUPERIOR Y MEDIA SUPERIOR PRIVADA,1,10005000100341000070111
4,10,005,0001,0068,100081,01,1,1,03,08, 2,555,PSICOLOGIA CLINICA,4,1,1,1,1,2,28,2,,,1,2,1,,4,PERITAJES FORENSES EN CASOS DE HOMICIDIO O VIOLACION,11,PERITO FORENSE,PSIKOLOGIA JURIDIKA,93,A REALIZAR PERITAJES FORESNSES EN CASOS DE HOMICIDIO O VIOLA,2,10005000100681000810111
4,10,005,0001,0068,100081,02,1,1,01,08, 2,592,MAESTRIA EN ADMINISTRACION DE EMPRESAS,4,2,2,2,1,2,32,2,,,1,1,1,,1,SUPERVISAR PROYECTOS MINEROS DE CONSTRUCCION,21,SUPERINTENDENTE DE CONSTRUCCION,MINAS DE SAN LUIS S.A. DE C.V.,21,"EXTRAER METALES, MINERALES (ORO, PLATA ZINC Y COBRE) CON MAQ",1,10005000100681000810211
4,10,005,0001,0068,100081,03,1,1,01,06, 3,052,CONTADOR PRIVADO,1,,,,,,,,,,,,1,,1,DAR COMUNION A LOS ENFERMOS Y AYUDAR A LOS PADRES EN LA EUCARISTIA,12,MINISTRO DE IGLESIA,TEMPLO SAGRADO CORAZON DE JESUS,81,PROPORCIONAR SERVICIOS ECLESIASTICOS,2,10005000100681000810311
4,10,005,0001,0068,100081,04,1,1,02,06, 3,186,SECRETARIA BILINGUE,2,,,,,2,18,2,,,2,1,5,5,,,,,,,,,10005000100681000810411
4,10,005,0001,0068,100081,05,1,1,04,04, 3,,,,,,,,1,20,1,2,1,,,4,5,,,,,,,,,10005000100681000810511
4,10,005,0001,0180,100390,01,1,1,03,07, 5,374,LICENCIADO EN DERECHO,3,2,2,2,2,1,28,2,,,1,1,1,,4,"PROMOVER AMPAROS, LITIGAR EN JUSGADOS LLEVAR JUICIOS Y DAR ASESORIA JU",11,LICENCIADO EN DERECHO PENAL,LICENCIADO EN DERECHO SIN NOMBRE,54,"PRESTAR EL SERVICIO JURIDICO, ASI COMO LLEVAR JUICIOS Y DAR",2,10005000101801003900111
4,10,005,0001,0180,100390,02,1,1,01,02, 6,,,,,,,,,,,,,,,1,,4,PULIR FIERROS DE HERRERIA Y SOLDAR PERFILES Y FABRICA PUERTAS Y VENTAN,52,HERRERO,HERRERIA SIN NOMBRE,33,FABRICAR PUERTAS Y VENTANAS METALICAS PARA SU VENTA AL POR M,2,10005000101801003900211
4,10,005,0001,0180,100390,03,1,1,02,05, 3,711,PROFESOR DE EDUCACION BASICA,2,,,,,1,23,2,,,2,2,6,5,,,,,,,,,10005000101801003900311
4,10,005,0001,0180,100390,04,1,1,01,06, 3,183,AUXILIAR DE CONTADOR,2,,,,,2,17,2,,,2,2,1,,1,ADMINISTRAR UNOS DEPARTAMENTOS ARREGLOS DE DIFERENTES,21,ADMINISTRADOR DE DEPARTAMENTOS,DEPARTAMENTOS PARTICULARES SIN NOMBRE,53,A LA PUERTA DE DEPARTAMENTOS,2,10005000101801003900411
4,10,005,0001,0265,100243,01,1,1,04,07, 5,374,LICENCIATURA EN DERECHO,3,2,2,2,2,1,26,2,,,2,2,1,,1,ATIENDE A DENUNCIANTES DE ALGUN DELITO ASI COMO DA TRAMITE A DICHAS DE,61,AGENTE DEL MINISTERIO PUBLICO,DIRECCION DE AVERIGUACIONES PREVIAS DEL ESTADO (DAP),93,A RECIBIR LAS DENUNCIAS DE PERSONAS Y TURNARLAS A LAS AUTORI,2,10005000102651002430111
4,10,005,0001,0265,100243,03,1,1,01,08, 2,542,ORTODONCISTA,4,1,2,1,2,2,30,2,,,1,2,1,,5,"PROPORCIONA SERVICIOS DENTALES ORTODONCICOS, ENDEREZAR LOS DIENTES",11,ORTODONCISTA,CENTRO DE ORTODONCIA,62,PROPORCIONAR SERVICIOS DENTALES ORTODONCICOS,2,10005000102651002430311
4,10,005,0001,0265,100243,04,1,1,01,07, 5,374,LICENCIADO EN DERECHO,3,2,2,2,2,1,26,2,,,2,2,1,,5,"ATENDER A CLIENTES, COBRARLES Y LLEVAR LA ADMINISTRACION DEL NEGOCIO D",71,DUEÑO DE TIENDA DEPORTIVA,G L SOCCER (G SIGNIFICA GAMERO),46,"A LA VENTA DE ARTICULOS DEPORTIVOS BALONES, UNIFORMES ZAPATO",2,10005000102651002430411
4,10,005,0001,0265,100243,05,1,1,02,07, 5,374,LICENCIADO EN DERECHO,3,2,2,2,2,1,23,2,,,2,2,1,,4,PROPORCIONAR EL SERVICIO DE DEFENSORIA LEGAL A CLIENTES,11,ABOGADO,DESPACHO SIN NOMBRE,54,PROPORCIONAR SERVICIOS DE DEFENSORIA LEGAL,2,10005000102651002430511
4,10,005,0001,0443,100052,01,1,1,02,06, 3,186,COMERCIO SECRETARIA BILINGÜE,2,,,,,1,19,2,,,1,2,5,5,,,,,,,,,10005000104431000520111
4,10,005,0001,0443,100052,02,1,1,04,07, 5,413,INGENIERIA EN SISTEMAS COMPUTACIONALES,3,2,1,1,1,1,22,2,,,1,1,1,,1,LLEVAR EL CONTROL DE DOCUMENTOS EN LA COMPUTADORA Y ATENCION AL PUBLIC,11,TECNICO ANALISTA COMPUTACIONAL,SECRETARIA DE EDUCACION PUBLICA DEL ESTADO DE DURANGO,93,PLANEACION Y EVALUACION EDUCATIVA DEL ESTADO POR MEDIO DE SU,2,10005000104431000520211
4,10,005,0001,0443,100052,03,1,1,01,03, 1,,,,,,,,,,,,,,,1,,2,"CONSTRUYE CASAS, PONE CIMIENTOS, PONE BARDAS, BATE MEZCLA, PONE LOSAS",52,MAESTRO ALBAÑIL,CONSTRUCTORA ENCIT CONSTRUCCION DE CASAS ABITACION,23,A LA CONSTRUCCION DE CASAS HABITACION DE INTERES SOCIAL CON,2,10005000104431000520311
4,10,005,0001,0443,100052,04,1,1,01,03, 3,,,,,,,,,,,,,,,1,,1,A LA PREPARACION DE COMIDA MANUALMENTE PARA SU CONSUMO INMEDIATO,52,COCINERA EN RESTAURANT,RESTAURT RINCON AZTECA,72,A LA PREPARACION DE ALIMENTOS PARA CONSUMO INMEDIATO EN UN R,2,10005000104431000520411
4,10,005,0001,0443,100052,05,1,1,01,05, 3,711,PROFESOR SW EDUACION BASICA,2,,,,,2,35,2,,,1,1,6,5,,,,,,,,,10005000104431000520511
4,10,005,0001,1761,100007,02,1,1,01,08, 2,541,MEDICINA INTERNA,4,2,2,2,2,1,34,2,,,1,2,1,,1,"ATENDER PACIENTES, PROPORCIONARLES MEDICAMENTOS Y SERVICIOS MEDICOS",11,MEDICO INTERNISTA O ESPECIALISTA,INSTITUTO MEXICANO DEL SEGURO SOCIAL,62,PROPORCIONAR SERVICIOS MEDICOS PUBLICOS A DERECHO HABIENTES,1,10005000117611000070211
4,10,005,0001,1761,100007,03,1,1,01,04, 3,,,,,,,,1,18,2,,,1,2,1,,1,ADMINISTRAR LOS RECURSOS HUMANOS Y LOS PROCESOS DE CAPACITACION EN UN,61,JEFA DE DEPARTAMENTO DE CAPACITACION,CECATI 36 CENTRO DE CAPACITACION PARA EL TRABAJO INDUSTRIAL,61,A CAPACITAR A PERSONAS PARA EL TRABAJO INDUSTRIAL EN UNA ESC,1,10005000117611000070311
4,10,005,0001,1761,100007,04,1,1,04,04, 3,,,,,,,,2,19,1,2,2,,,4,5,,,,,,,,,10005000117611000070411
4,10,005,0001,1761,100007,05,1,1,01,07, 4,401,LICENCIADA EN EDUCACION PREESCOLAR,3,2,2,2,1,1,57,2,,,1,1,1,,1,ELABORACION Y REALIZACION DE PROYECTOS PARA EDUCACION PREESCOLAR,61,JEFA DE AREA DEL TALLER DE ELABORACION DE MATERIAL DIDACTICO,SEP SECRETARIA DE EDUCACION PUBLICA,93,A IMPARTIR EDUCACION A DIFERENTES NIVELES ASI COMO ADMINISTR,1,10005000117611000070511
4,10,005,0001,1973,100129,01,1,2,05,03, 3,,,,,,,,,,,,,,,5,2,4,CORTAR Y PINTAR CABELLO A DOMICILIO,81,ESTILISTA,ESTILISTA SIN NOMBRE,81,CORTAR Y PINTAR CABELLO EN EL DOMICILIO DE LOS CLIENTES,2,10005000119731001290112
4,10,005,0001,1973,100129,01,2,2,02,03, 3,,,,,,,,,,,,,,,1,,1,VENDER PLANES PREVISORES PARA EN CASO DE FALLECIMIENTO EN UNA FUNERARI,71,VENDEDORA DE PLANES PREVISORES,FUNERALES GARRIDO,81,"PRESTAR SERVICIO DE FUNERALES, VENTA DE ATAUDES EN UNA FUNER",2,10005000119731001290122
4,10,005,0001,1973,100129,02,1,1,02,03, 3,,,,,,,,,,,,,,,1,,1,AYUDAR EN LA PREPARACION DE ALIMENTOS Y REPARTIRLOS A LOS NIÑOS SINTER,54,AUXILIAR DE COCINA,HOSPITAL DE NIÑO (PERTENECE AL MUNICIPIO),62,"BRINDAR SERVICIOS MEDICOS: ANALISIS RAYOS X, INYECCIONES CON",1,10005000119731001290211
4,10,005,0001,1973,100129,03,1,1,02,03, 3,,,,,,,,,,,,,,,5,5,,,,,,,,,10005000119731001290311
4,10,005,0001,1973,100129,04,1,1,01,03, 3,,,,,,,,,,,,,,,2,,4,CORTAR Y PINTAR CABELLO EN EL DOMICILIO DE LOS CLIENTES,81,ESTILISTA,ESTILISTA SIN NOMBRE,81,CORTAR Y PINTAR CABELLO EN EL DOMICILIO DE LOS CLIENTES,2,10005000119731001290411
4,10,005,0001,1973,100129,05,1,1,02,03, 3,,,,,,,,,,,,,,,1,,1,CHECAR QUE PROCESEN EL EFECTIVO QUE LES ENTREGUEN LOS CLIENTES,61,SUPERVISOR DE PROCESO DE EFECTIVO,SERVICIO PANAMERICANA DE PROTECCION,56,PRESTAR EL SERVICIO DE TRASLADO DE VALORES EN VEHICULOS BLIN,2,10005000119731001290511
4,10,005,0001,2242,100224,01,1,1,04,03, 3,,,,,,,,,,,,,,,1,,2,PULIR MADERA Y LIJAR MUEBLES,53,LIJADOR DE MUEBLES,FABRICA DE MUEBLES DURANGO,33,A LA FABRICACION DE MUEBLES DE MADERA Y A SU VENTA POR MAYOR,2,10005000122421002240111
4,10,005,0001,2242,100224,03,1,1,01,02, 6,,,,,,,,,,,,,,,5,5,,,,,,,,,10005000122421002240311
4,10,005,0001,2242,100224,04,1,1,01,03, 1,,,,,,,,,,,,,,,1,,1,MOVER MADERA Y METER A LA SIERRABANDA,53,MANTEADOR OPERADOR DE SIERRABANDA,ASERRADERO FORESTAL VIZCAYA,32,A LA TRANSFORMACION DE MADERA DE PINO Y A SU VENTA AL POR MA,2,10005000122421002240411
4,10,005,0001,2242,100224,05,1,1,02,03, 3,,,,,,,,,,,,,,,1,,4,PROMOCIONAR CAMARAS IP POR INTERNET Y HACER ENLACES UPN ENTRE OFICINAS,12,TECNICO EN SISTEMAS,SERVICIOS ADMINISTRATIVOS Y COMPUTACIONALES,54,A PRESTAR EL SERVICIO DE COMUNICACION VOZ Y DATOS E IMAGEN Y,1,10005000122421002240511
4,10,005,0001,2469,100410,01,1,1,02,03, 3,,,,,,,,,,,,,,,5,5,,,,,,,,,10005000124691004100111
4,10,005,0001,2469,100410,02,1,1,06,03, 3,,,,,,,,,,,,,,,1,,1,PROMOVER Y LEVANTAR PEDIDOS DE FORMULAS DE LECHE EN FARMACIASY TIENDAS,71,PEOMOTOR DE FORMULAS DE LECHE,DISTRIBUIDORA WYETH LABORATORIO,43,A LA VENTA DE FORMULAS DE LECHE Y MEDICAMENTOS EN FARMACIAS,3,10005000124691004100211
4,10,005,0001,2469,100410,03,1,1,01,02, 3,,,,,,,,,,,,,,,5,5,,,,,,,,,10005000124691004100311
4,10,005,0001,2469,100410,04,1,1,02,07, 1,371,LICENCIATURA EN TRABAJO SOCIAL,3,2,2,2,1,1,19,2,,,2,2,5,5,,,,,,,,,10005000124691004100411
4,10,005,0001,2469,100410,05,1,1,01,03, 3,,,,,,,,,,,,,,,1,,1,COBRAR A CLIENTES,62,CAJERO DE RESTAURANT,RESTAURANTE LOS MANZANOS,72,SE DEDICA A LA ELABORACION DE ALIMENTOS PARA SU CONSUMO INME,2,10005000124691004100511
4,10,005,0001,2488,100180,02,1,1,05,04, 3,,,,,,,,1,18,1,1,1,,,4,5,,,,,,,,,10005000124881001800211
4,10,005,0001,2488,100180,03,1,1,02,02, 2,,,,,,,,,,,,,,,5,5,,,,,,,,,10005000124881001800311
4,10,005,0001,2488,100180,04,1,1,01,03, 3,,,,,,,,,,,,,,,1,,4,PROPORCIONA SERVICION COMO CANTANTE DE MUSICA CRISTIANA,14,CANTANTE DE MUSICA CRISTIANA,LIBRADO RETANA,81,A PROPORCIONAR SERVICIOS COMO CANTANTE DE MUSICA CRISTIANA E,2,10005000124881001800411
4,10,005,0001,2488,100180,05,1,1,02,04, 3,,,,,,,,1,18,2,,,1,2,1,,1,CAPTURAR EXPEDIENTES ELABORAR OFICIOS MANEJAR ARCHIVOS SUBIR A INTERNE,62,SECRETARIA EJECUTIVA,SUPREMO TRIBUNAL DE JUSTICIA,93,RESOLVER ASUNTOS CIVILES Y MERCANTILES DE PARTICULARES MEDIA,1,10005000124881001800511
4,10,005,0001,2539,100299,01,1,1,02,06, 2,186,SECRETARIADO,2,,,,,1,17,2,,,2,2,1,,1,RECIBE Y DESTINA DOCUMENTOS DE CARTERA VENCIDA PARA QUE SEAN REVISADOS,12,OFICIAL DE TESORERIA,SUB DELEGACION METROPOLITANA DEL INSTITUTO MEXICANO DEL SEGU,93,SE REALIZAN AUDITORIAS Y TRAMITES RELACIONADOS CON DERECHO H,1,10005000125391002990111
4,10,005,0001,2539,100299,02,1,1,02,07, 4,411,INGENIERIA CIVIL,3,2,2,1,1,1,22,2,,,1,2,2,,1,IMPARTIR CLASES FRENTE A GRUPO DE SECUNDARIA,13,PROFESOR DE SECUNDARIA PUBLICA,SECUNDARIA ESTATAL GENERAL MANUEL AVILA CAMACHO PUBLICA,61,A IMPARTIR EDUCACION A NIVEL SECUNDARIA EN UNA ESCUELA PUBLI,2,10005000125391002990211
4,10,005,0001,2539,100299,03,1,1,01,07, 5,393,CONTADOR PUBLICO,3,2,2,2,1,1,35,2,,,2,1,1,,1,REBISAR CONTABILIDAD RELACIONADAS CON AUDITORIA A PATRONES DE DIFERENT,11,AUDITOR,SUB DELEGACION DEL INSTITUTO MEXICANO DEL SEGURO SOCIAL (IMS,93,"A LA ADMINISTRACION DE ALTAS, BAJAS, PAGOS Y TRAMITES RELACI",1,10005000125391002990311
4,10,005,0001,2539,100299,04,1,1,02,03, 3,,,,,,,,,,,,,,,5,5,,,,,,,,,10005000125391002990411
4,10,005,0001,2539,100299,05,1,1,04,04, 1,,,,,,,,1,18,1,2,1,,,4,5,,,,,,,,,10005000125391002990511
4,10,005,0001,2581,100407,01,1,1,04,02, 6,,,,,,,,,,,,,,,1,,2,"PONER PISO, COLAR UNA ESCALERA Y HACER MESCLA",54,AYUDANTE DE ALBAÑIL,ALBAÑIL SIN NOMBRE,23,A LA CONSTRUCCION DE CASAS ABITACION Y TODO TIPO DE ARREGLOS,2,10005000125811004070111
4,10,005,0001,2581,100407,02,1,1,01,02, 2,,,,,,,,,,,,,,,5,5,,,,,,,,,10005000125811004070211
4,10,005,0001,2581,100407,03,1,1,01,02, 3,,,,,,,,,,,,,,,1,,4,"ATENDER A CLIENTES Y COBRARLES, VENTA DULCES, GOLOCINAS CHURROS Y DURO",71,VENDEDORA DE DULCES Y CHURROS,VENDEDORA DE DULCES Y CHURROS SIN NOMBRE,46,A LA VENTA DE DULCES Y DUROS AL POR MENOR EN SU DOMICILIO,2,10005000125811004070311
4,10,005,0001,2581,100407,05,1,1,02,02, 3,,,,,,,,,,,,,,,5,5,,,,,,,,,10005000125811004070511
4,10,005,0001,2736,100229,01,1,1,03,06, 2,184,COMERCIO SECRETARIADO,2,,,,,1,18,2,,,2,2,1,,1,DESPACHAR GASOLINA AL PUBLICO EN GENERAL Y COBRARLA,71,DESPACHADORA DE GASOLINA,GASOLINERA SUPER SERVICIO SAN JUAN,46,A LA VENTA DE GASOLINA ASEITES Y ADITIVOS AL POR MENOR EN UN,2,10005000127361002290111
4,10,005,0001,2736,100229,02,1,1,01,02, 6,,,,,,,,,,,,,,,6,5,,,,,,,,,10005000127361002290211
4,10,005,0001,2736,100229,03,1,1,01,03, 3,,,,,,,,,,,,,,,1,,1,DESPACHAR GASOLINA COBRAR Y DAR EL CAMBIO CHECAR LLANTAS Y ACEITE,71,DESPACHADOR DE GASOLINA,GASOLINERA SERVICIOS SAGIS,46,"A LA VENTA DE GASOLINA Y DISEL ACEITES Y ADITIVO, AL PORMENO",2,10005000127361002290311
4,10,005,0001,2736,100229,04,1,1,02,03, 3,,,,,,,,,,,,,,,1,,2,OPERA UNA MAQUINA QUE PRODUCE CABLE ELECTRICO QUE SE UTILIZA EN LA ELA,53,OPERADORA DE MAQUINA AC-81,MAQUILADORA AUTOPARTES Y ARNESES DE DURANGO S.A. DE C.V,33,A LA FABRICACION DE ARNESES Y AUTOPARTES ELECTRICAS PARA AUT,2,10005000127361002290411
4,10,005,0001,2736,100229,05,1,1,02,02, 6,,,,,,,,,,,,,,,5,5,,,,,,,,,10005000127361002290511
4,10,005,0001,3594,100281,01,1,1,02,03, 3,,,,,,,,,,,,,,,1,,2,ENSAMBLAR HEMBRA Y MACHO DE CABLES ELECTRICOS PARA MOTORES AUTOMOTRICE,53,"ENCARGADO DE SUBENSABLE, MANUALMENTE",MAQUILADORA AUTOPARTES Y ARNESES DE DURANGO,33,FABRICAR ARNESES PARA PARTES DE MOTORES Y CARROSERIA AL POR,2,10005000135941002810111
4,10,005,0001,3594,100281,02,1,1,03,03, 1,,,,,,,,,,,,,,,8,5,,,,,,,,,10005000135941002810211
4,10,005,0001,3594,100281,03,1,1,01,03, 3,,,,,,,,,,,,,,,1,,1,APAGAR INCENDIOS Y DAR SERVICIO DE EMERGENCIAS,83,BOMBERO,DIRECCION MUNICIPAL DE PROTECCION CIVIL,93,A PRESTAR AUXILIO A LA CIUDADANIA,2,10005000135941002810311
4,10,005,0001,3594,100281,04,1,1,01,03, 2,,,,,,,,,,,,,,,1,,4,ENYESAR UNA CASA Y HACER YESO,52,YESERO,YESERO SIN NOMBRE,23,A ENYESAR PAREDES Y TECHOS EN CASAS PARTICULARES,2,10005000135941002810411
4,10,005,0001,3594,100281,05,1,1,01,02, 6,,,,,,,,,,,,,,,1,,4,A LA CONSTRUCCION DE UN BAÑO PEGAR AZULEJO HACER MEZCLA,52,ALBAÑIL,ALBAÑIL SIN NOMBRE,23,A LA CONSTRUCCION DE CASA ABITACION Y DETAYES,2,10005000135941002810511
4,10,005,0001,3895,100373,01,1,1,02,04, 2,,,,,,,,1,18,1,2,1,,,4,5,,,,,,,,,10005000138951003730111
4,10,005,0001,3895,100373,02,1,1,02,06, 3,186,SECRETARIADO BILINGÛE,2,,,,,1,19,2,,,2,2,1,,1,"ELABORAR OFICIOS, TOMAR DICTADOS, ARCHIVAR PAPELES Y CONTESTAR LLAMDAS",62,SECRETARIA EJECUTIVA,COORPORATIVO DE MINAS DE SAN LUIS S.A. DE C.V. ESTADO DE DUR,55,"PRESTA EL SERVICIO DE ADMINISTRACION, ASESORIA TECNICA, ASI",2,10005000138951003730211
4,10,005,0001,3895,100373,03,1,1,03,04, 2,,,,,,,,1,19,1,2,1,,,1,,1,CUIDAR A LOS NIÑOS EN LOS JUEGOS,81,ENCARGADO DE AREA DE BEBES,MALIBU CENTRO DE DIVERSIONES,71,A PRESTAR EL SERVICIO DE DIVERSION PARA NIÑOS EN JUEGOS INFA,2,10005000138951003730311
4,10,005,0001,3895,100373,04,1,1,02,04, 3,,,,,,,,1,18,2,,,2,1,1,,1,"TEÑIR MUESTRAS DE PAPNICOLAO, LAS CUBRE Y LAS NUMERA",12,TECNICO LABORATORISTA,HOSPITAL GENERAL DE DURANGO,62,A PRESTAR EL SERVICIO DE SALUD EN GENERAL A LA CIUDADANIA EN,2,10005000138951003730411
4,10,005,0001,3895,100373,05,1,1,02,02, 2,,,,,,,,,,,,,,,5,5,,,,,,,,,10005000138951003730511
4,10,005,0001,4200,100364,01,1,1,01,06, 4,144,ENFERMERIA GENERAL,2,,,,,2,36,2,,,1,2,1,,1,ATENCION GENERAL AL PACIENTE ADULTO,12,ENFERMERA GENERAL DE ADULTOS,HOSPITAL GENERAL,62,PROPORCIONAR SERVICIOS MEDICOS A LA POBLACION EN GENERAL,1,10005000142001003640111
4,10,005,0001,4200,100364,02,1,1,01,02, 6,,,,,,,,,,,,,,,1,,5,PINTAR LAS PAREDES DE UNA CASA,52,PINTOR DE CASAS,PINTOR SIN NOMBRE,23,A PROPORCIONAR EL SERVICIO DE PINTURA EN CASAS PARTICULARES,2,10005000142001003640211
4,10,005,0001,4200,100364,03,1,1,01,02, 6,,,,,,,,,,,,,,,1,,1,BARRER Y TRAPEAR EN LOS AVIONES,81,ENCARGADO DE LIMPIEZA EN LOS AVIONES,SERVICIOS AEREOS DEL GOBIERNO DEL ESTADO,93,SE DEDICA A PROPORCIONAR EL SERVICIO DE TRANSPORTACION DE GE,2,10005000142001003640311
4,10,005,0001,4200,100364,04,1,1,01,06, 3,055,SECRETARIA BILINGUE,1,,,,,,,,,,,,1,,1,REALIZAR LABORES DE LIMPIEZA EN UN JARDIN DE NIÑOS,81,INTENDENTE,JARDIN DE NIÑOS INGENIERO JESUS TEVAR,61,A PROPORCIONAR SERVICIOS DE EDUCACION PREESCOLAR PUBLICA,2,10005000142001003640411
4,10,005,0001,4200,100364,05,1,1,01,02, 6,,,,,,,,,,,,,,,1,,4,ELABORACION DE GORDAS Y TACOS EN SU DOMICILIO,81,GORDERA,GORDERA SIN NOMBRE,72,A LA ELABORACION Y VENTA DE GORDAS Y TACOS EN SU DOMICILIO,2,10005000142001003640511
4,10,005,0001,4323,100194,02,1,1,04,04, 3,,,,,,,,2,18,1,2,1,,,4,5,,,,,,,,,10005000143231001940211
4,10,005,0001,4323,100194,03,1,1,01,02, 6,,,,,,,,,,,,,,,1,,4,ATENDER CLIENTES COBRARLES Y DARLES CAMBIO EN UNA TIENDA,71,COMERCIANTE DE ABARROTES,MISCELANEA SIN NOMBRE,46,A LA VENTA DE ABARROTES AL POR MENOR,2,10005000143231001940311
4,10,005,0001,4323,100194,04,1,1,02,07, 3,363,INGENIERIA BIOQUIMICA,3,1,1,1,1,1,22,1,1,1,,,1,,1,ATENDER Y DARLES SEGUIMIENTO A QUEJAS DE PERSONAS QUE VIENEN DE ESTADO,62,OBSERVADOR PROGRAMA PAISANO,INSTITUTO NACIONAL DE MIGRACION,93,RECIBIR QUEJAS DEL PROGRAMA PAISANO Y DEPORTAR A MIGRANTES,2,10005000143231001940411
4,10,005,0001,4357,100234,01,1,1,01,08, 1,593,MAESTRIA EN IMPUESTOS PUBLICOS,4,2,2,2,1,2,30,1,1,2,,,1,,1,CALCULAR IMPUESTOS Y PLANEACIONES FISCALES EN UNA EMPRESA,11,ENCARGADA DEL DEPARTAMENTO DE IMPUESTOS,ATALAYA DE ARGENTA S.A. DE C.V.,56,PRESTAR SERVICIOS ADMINISTRATIVOS A EMPRESAS PRIVADAS,2,10005000143571002340111
4,10,005,0001,4357,100234,02,1,1,02,07, 5,393,CONTADOR PUBLICO,3,2,2,2,1,1,24,2,,,2,1,1,,1,REALIZAR ESTUDIOS A LOS CONTRIBUYENTES DE EMPRESAS PARA POSIBLES AUDIT,11,PROGRAMADOR DE AUDITORIAS,SECRETARIA DE FINANZAS DEL ESTADO DE DURANGO,93,RECAUDAR INGRESOS ADMINISTRARLOS Y APLICARLOS A LA OBRA PUBL,2,10005000143571002340211
4,10,005,0001,4357,100234,03,1,1,01,07, 5,392,LICENCIADO EN ADMINISTRACION DE EMPRESAS,3,2,2,2,1,1,24,2,,,2,1,1,,5,DISEÑAR E IMPRIMIR FORMATOS ADEMAS DE ADMINISTRAR EL NEGOCIO DE IMPREN,52,ADMINISTRADOR DE IMPRENTA,RAZA IMPRESORES,32,PRESTAR EL SERVICIO DE IMPRENTA DE FORMATOS ASI COMO EL DE E,2,10005000143571002340311
4,10,005,0001,4357,100234,05,1,1,01,04, 3,,,,,,,,1,18,2,,,2,1,1,,1,LEVANTAR PEDIDOS DE LACTEOS CON UNA HAND HELL (LIBRETA ELECTRONICA),71,REPRESENTANTE DE VENTAS,YAKULT NOMBRE JAPONES SIGNIFICA YUGURTH,31,ELABORACION Y DISTRIBUCION DE LACTEOS,1,10005000143571002340511
4,10,005,0001,4450,100037,01,1,1,02,06, 3,186,SECRETARIADO,2,,,,,1,25,2,,,2,2,1,,1,CUIDA A LA GENTE QUE NO ROBE MERCANCIA DE UNA TIENDA Y QUE TODO ESTE E,83,GUARDIA DE SEGURIDAD DE UNA TIENDA,GIGANTE S.A. DE C.V.,46,"A LA VENTA AL MENUDEO DE ABARROTES, ROPA, COMIDA HERRAMIENTA",2,10005000144501000370111
4,10,005,0001,4450,100037,02,1,1,02,03, 3,,,,,,,,,,,,,,,5,5,,,,,,,,,10005000144501000370211
4,10,005,0001,4450,100037,03,1,1,01,03, 3,,,,,,,,,,,,,,,1,,1,ARCHIVAR DOCUMENTACION MILITAR CONFIDENCIAL,62,ARCHIVISTA,SECRETARIA DE LA DEFENSA NACIONAL,93,SALVAGUARDAR LA SOBERANIA Y PRESTAR APOYO A LA POBLACION CIV,2,10005000144501000370311
4,10,005,0001,4450,100037,04,1,1,01,02, 6,,,,,,,,,,,,,,,1,,4,"VISITAR A CLIENTES ENTREGAR CATALOGOS, RECIBIR Y ENTREGAR PEDIDOS DE P",72,VENDEDORA POR CATALOGO FULLER,VENDEDORA SIN NOMBRE,43,A LA VENTA DE PRODUCTOS DE BELLEZA POR CATALOGO VISITANDO A,2,10005000144501000370411
4,10,005,0001,4450,100189,01,1,1,01,05, 4,711,PROFESOR DE EDUCACION PRIMARIA,2,,,,,1,18,2,,,2,2,1,,1,IMPARTIR CLASES A NIVEL PRIMARIA,13,MAESTRO DE PRIMARIA,ESCUELA PRIMARIA PUBLICA HEROES DE CHAPULTEPEC,61,IMPARTIR EDUCACION A NIVEL PRIMARIA EN UNA ESCUELA PUBLICA,2,10005000144501001890111
4,10,005,0001,4450,100189,02,1,1,01,04, 3,,,,,,,,1,18,2,,,1,1,1,,5,"ATIENDE A CLIENTES, OFRECE SU MERCANCIA Y COBRA",71,COMERCIANTE DE FRUTAS Y VERDURAS,COMERCIANTE SIN NOMBRE,46,A LA VENTA DE FRUTAS Y VERDURAS AL POR MENOR EN UN PUESTO SE,2,10005000144501001890211
4,10,005,0001,4450,100189,03,1,1,01,02, 6,,,,,,,,,,,,,,,1,,1,LAVAR LOS ENVASES EN UNA PURIFICADORA DE AGUA,54,LAVADOR DE ENVASES,AGUA PURIFICADA MARINA,31,PURIFICACION Y VENTA DE AGUA POTABLE EN LAS INSTALACIONES,2,10005000144501001890311
4,10,005,0001,4450,100189,04,1,1,01,04, 3,,,,,,,,1,20,2,,,1,2,1,,1,OPERAR UNA MAQUINA PARA PONERLE PLASTICO A LOS ALAMBRES DE COBRE,53,OPERADOR DE MAQUINA DE PVC 4,DRAKA MAQUILADORA,33,A FABRICAR CABLE AUTOMOTRIZ Y AEREO EN UNA FABRICA,1,10005000144501001890411
4,10,005,0001,4450,100189,05,1,1,01,02, 6,,,,,,,,,,,,,,,1,,1,"LIMPIAR, BARRER Y TRAPEAR EN UN CENTRO COMERCIAL",81,INTENDENTE DE CENTRO COMERCIAL,CENTRO COMERCIAL SORIANA,46,"A LA VENTA DE ABARROTES COMESTIBLES Y NO COMESTIBLES, LACTEO",2,10005000144501001890511
4,10,005,0001,4592,100181,02,1,1,01,07, 5,393,CONTADOR PUBLICO,3,2,1,2,1,1,28,2,,,2,2,1,,4,"ASESORA A PERSONAS FISICAS Y NEGOSIOS EN SU CONTABILIDAD, ADEMAS DE LL",11,CONTADOR PUBLICO,CONTADURIA PUBLICA SIN NOMBRE,54,PRESTA EL SERVICIO DE ASESORIA CONTABLE Y FISCAL A PERSONAS,2,10005000145921001810211
4,10,005,0001,4592,100181,03,1,1,02,02, 3,,,,,,,,,,,,,,,5,5,,,,,,,,,10005000145921001810311
4,10,005,0001,4592,100181,04,1,1,03,02, 3,,,,,,,,,,,,,,,8,5,,,,,,,,,10005000145921001810411
4,10,005,0001,4592,100181,05,1,1,03,04, 3,,,,,,,,1,18,1,2,1,,,4,5,,,,,,,,,10005000145921001810511
4,11,020,0001,0374,110051,01,1,1,02,00, 0,,,,,,,,,,,,,,,5,5,,,,,,,,,11020000103741100510111
4,11,020,0001,0374,110051,02,1,1,01,02, 6,,,,,,,,,,,,,,,1,,2,SUPERVISO EL PROCESO DE PESPUNTE,51,SUPERVISOR,LEYDY LORY,31,ELABORACION DE CALZADO DE PIEL Y SINTETICO PARA DAMA,2,11020000103741100510211
4,11,020,0001,0374,110051,03,1,1,03,04, 1,,,,,,,,1,20,2,,,1,2,2,,4,VENTA DE ARTICULOS USADOS,71,COMERCIANTE,NO TIENE NOMBRE,46,VANTAS DE GARAGE O EN UN TIANGUIS,2,11020000103741100510311
4,11,020,0001,0374,110051,04,1,1,01,02, 3,,,,,,,,,,,,,,,1,,4,"PINTA CASAS, FACHADAS",52,PINTOR DE BROCHA GORDA,NO TIENE NOMBRE,23,PRESTACION DE SERVICIOS A CASAS PARTICULARES TRABAJABOS DE P,2,11020000103741100510411
4,11,020,0001,0374,110051,05,1,1,02,02, 1,,,,,,,,,,,,,,,1,,1,RECOLECTA TORTILLAS EN UNA TORTILLERIA,54,AYUDANTE DE TORTILLERIA,TORTILLERIA LA SAN JUANITA,31,ELABORACION DE TORTILLAS DE MAIZ Y A SU COMERCIALIZACION,2,11020000103741100510511
4,11,020,0001,0406,110440,01,1,1,01,03, 3,,,,,,,,,,,,,,,1,,1,ATENCION AL CLIENTE PROMOVER LOS VESTIDOS Y MOSTRAR MERCANCIA,71,VENDEDORA,GRUPO JOYA,31,CONFECCION Y VENTA DE VESTIDOS PARA NOVIA EN UN LOCAL,2,11020000104061104400111
4,11,020,0001,0406,110440,02,1,1,02,07, 5,374,LICENCIATURA EN DERECHO,3,1,1,1,1,2,22,2,,,1,2,1,,1,SUPERVICION SEGUIMIENTO DE ACUERDOS ORGANISACION Y ANALISIS,61,ASISTENCIA SOCIAL SUBDIRECCION DE SEGUIMIENTO Y COORDINACION,DIRECCION GENERAL DE REABILITACION Y ASISTENCIA SOCIAL ENDIF,62,INSTITUCION PUBLICA,2,11020000104061104400211
4,11,020,0001,0406,110440,03,1,1,01,00, 0,,,,,,,,,,,,,,,1,,1,"BARRER, TRAPEAR PISOS, LAVAR TAZAS DE BAÑO Y APLICAR AROMATIZANTE EN L",81,LIMPIEZA DE BAÑOS,CENTRO COMERCIAL ALLENDE,81,PRESTACION DE SERVICIOS SANITARIOS AL PUBLICO EN GENERAL EN,2,11020000104061104400311
4,11,020,0001,0406,110440,04,1,1,01,08, 2,574,AMPARO,4,2,2,2,2,2,42,2,,,2,2,1,,1,ATENCION A USUARIOS,21,COORDINADOR ESTATAL DE LA UNIDAD DEL MENOR,DIF ESTATAL DE GUANAJUATO,62,ATENCION A ASISTENCIA SOCIAL,1,11020000104061104400411
4,11,020,0001,0406,110440,05,1,1,02,02, 6,,,,,,,,,,,,,,,1,,1,"SUPERVICION, CORDINACION T DIRECCION DE LAS ACTIVIDADES DE LOS OBREROS",51,ENCARGADO DE PERSONAL,CALZADO MOONHES,31,FABRICACION Y VENTA DE CALZADO DE PIEL EXOTICA EN UNA FABRIC,2,11020000104061104400511
4,11,020,0001,0478,110073,02,1,1,02,00, 0,,,,,,,,,,,,,,,5,5,,,,,,,,,11020000104781100730211
4,11,020,0001,0478,110073,03,1,1,01,04, 3,,,,,,,,1,19,2,,,2,1,1,,1,SUPERVICION DE CONTROL DE CALIDAD DE PRODUCTO ELABORADO,51,ENCARGADO FABRICACION DE PRODUCTO,PRODUCTOS SEPA,32,COMERCIALIZACION Y FABRICACION ADHESIVOS,2,11020000104781100730311
4,11,020,0001,0478,110073,04,1,1,01,02, 2,,,,,,,,,,,,,,,7,,,,,,,,,,11020000104781100730411
4,11,020,0001,0478,110073,05,1,1,01,02, 3,,,,,,,,,,,,,,,1,,2,UNIR LAS PIEZAS DEL CALZADO DE PIEL UTILIZANDO MAQUINA DE PESPUNTAR,52,PESPUNTADOR DE CALZADO,NO TIENE NOMBRE,31,FABRICAICON Y VENTA DE CALZADO DE PIEL EN LOCAL,2,11020000104781100730511
4,11,020,0001,068A,110276,01,1,1,02,06, 3,183,CONTADOR PRIVADO,2,,,,,2,18,2,,,2,1,1,,6,,,,,,,,110200001068A1102760111
4,11,020,0001,068A,110276,02,1,1,03,02, 6,,,,,,,,,,,,,,,2,,1,OFICIAL DE ALBAÑILERIA CORDINA TODO LO QUE SE REALIZA EN UNA OBRA,52,ALBAÑIL,NO TIENE NOMBRE,23,A LA CONSTRUCCION DE CASAS HABITACION,2,110200001068A1102760211
4,11,020,0001,068A,110276,03,1,1,03,06, 2,191,TECNICA EN EDUCACION,2,,,,,2,45,2,,,1,2,1,,1,EMPLEADA DE MOSTRADOR ATENDIENDO PERSONAS,71,EMPLEADA DE MOSTRADOR,NOVIAS VERSALLES,46,VENTA DE ROPA,2,110200001068A1102760311
4,11,020,0001,068A,110276,05,1,1,01,02, 3,,,,,,,,,,,,,,,6,2,2,MONTAR ZAPATO,52,MONTADOR DE ZAPATO,NO SABE,33,ELABORACION DE CALZADO ORTOPEDICO DE NIÑO,2,110200001068A1102760511
4,11,020,0001,0694,110250,01,1,1,01,03, 2,,,,,,,,,,,,,,,1,,4,"trabajos de afilador, afilar todo tipo de herramientas de corte",52,maestro afilador,no tiene nombre,81,realiza trabajos de afilar herramientas cortantes,2,11020000106941102500111
4,11,020,0001,0694,110250,02,1,1,02,02, 5,,,,,,,,,,,,,,,5,2,4,realizar labores de limpieza,81,afanadora,en una relojeria sin nombre,81,reparacion y venta de relojes,3,11020000106941102500211
4,11,020,0001,0694,110250,03,1,3,01,02, 2,,,,,,,,,,,,,,,6,5,,,,,,,,,11020000106941102500313
4,11,020,0001,0694,110250,03,2,3,02,00, 0,,,,,,,,,,,,,,,1,,2,cortar deshebrar y empacar concerniente a las mochilas,54,preliminar,masimex,31,maquilar toda clase de mochilas y bolsas,3,11020000106941102500323
4,11,020,0001,0694,110250,03,3,3,01,03, 2,,,,,,,,,,,,,,,1,,4,arrimar material hacer mezcla pegar tabique armar castillos,52,albañil,no tiene nombre,23,a la reparacion y construccion de viviendas en el domicilio,2,11020000106941102500333
4,11,020,0001,0694,110250,04,1,1,01,02, 3,,,,,,,,,,,,,,,1,,5,articulos de piel vende y comercializa,52,talabartero,creaciones alan,31,elaboracion de articulos de piel,2,11020000106941102500411
4,11,020,0001,0694,110250,05,1,1,02,00, 0,,,,,,,,,,,,,,,6,5,,,,,,,,,11020000106941102500511
4,11,020,0001,0730,110514,01,1,1,02,04, 3,,,,,,,,2,19,2,,,2,1,1,,1,"SUPERVISOR LLEVAR CONTROL DE ZAPATERIA VENTAS, INVENTARIOS ENTRADAS Y",21,GERENTE DE ZAPATERIA 3 HERMANOS,3 HERMANOS ZAPATERIA,31,HECHURA Y VENTA DE ZAPATOS,2,11020000107301105140111
4,11,020,0001,0730,110514,03,1,1,02,04, 3,,,,,,,,1,23,2,,,2,1,5,5,,,,,,,,,11020000107301105140311
