4,23,005,0001,0243,230092,05,1,1,01,04, 3,,,,,,,,1,18,2,,,2,1,1,,1,VER QUE ESTEN EN VIGENCIA LOS VEHICULOS COMO PAGO DE TENENCIA MECANICA,62,ENCARGADA DE MANTENIMIENTO DE VEHICULOS EN GRAL.Y CONTROL DE, GUARDIANES DEL SURESTE,56,SEGURIDAD PRIVADA A EMPRESAS PARTICULARES,1,23005000102432300920511
4,23,005,0001,0385,230085,03,1,1,01,07, 4,421,MATEMATICO,3,2,2,2,1,1,25,2,,,1,2,1,,5,SUPERVISION CONSTRUCCION,51,PATRON,SEGURITI S.A. DE C.V.,23,INMOBILIARIA BIENES RAICES CONSTRUCCION,2,23005000103852300850311
4,23,005,0001,0385,230085,04,1,1,01,07, 4,393,CONTADOR PUBLICO,3,2,2,2,1,1,22,2,,,2,2,1,,5,DUEÑO,71,PATRON,MARIANA Y SUS CONCHAS,46,VENTA DE RECUERDOS ARTICULOS PARA PLAYA ARTEZANIAS DE CARACO,2,23005000103852300850411
4,23,005,0001,0455,230347,01,1,1,03,07, 2,392,LICENCIATURA EN ADMINISTRACION DE EMPRESAS,3,2,2,2,2,1,21,1,2,2,,,4,5,,,,,,,,,23005000104552303470111
4,23,005,0001,0455,230347,02,1,1,02,02, 6,,,,,,,,,,,,,,,5,5,,,,,,,,,23005000104552303470211
4,23,005,0001,0455,230347,03,1,1,01,03, 3,,,,,,,,,,,,,,,1,,4,REPARAR MOTORES DE AUTOBUSES FRENOS CLOCH SUSPENSION,52,MECANICO AUTOMOTRIZ,TALLER MECANICO AUTOMOTRIZ DIESEL,81,SERVICIO DE MANTENIMIENTO Y REPARACION A MAQUINARIA DE AUTOB,2,23005000104552303470311
4,23,005,0001,0455,230347,04,1,1,04,03, 3,,,,,,,,,,,,,,,5,5,,,,,,,,,23005000104552303470411
4,23,005,0001,0455,230347,05,1,1,05,07, 4,413,INGENIERIA EN SISTEMAS COMPUTACIONALES,3,2,1,1,1,1,22,1,2,1,,,4,5,,,,,,,,,23005000104552303470511
4,23,005,0001,0474,230401,01,1,1,04,03, 3,,,,,,,,,,,,,,,1,,4,revision chequeo reparacion de motores de autos,52,macanico automotriz,taller jorge,81,servicio de mecanica automotriz en general en taller mecanic,2,23005000104742304010111
4,23,005,0001,0474,230401,02,1,1,01,06, 3,183,contador administrador fiscal contador privado,2,,,,,1,22,2,,,2,1,1,,4,manejar automovil transporta usuarios a diferentes lugares,55,chofer de taxi,FernandoDuarte,48,servicio de transporte a pasajeros en general en taxi,3,23005000104742304010211
4,23,005,0001,0474,230401,03,1,1,02,02, 6,,,,,,,,,,,,,,,1,,1,CORTE DE PELO SEGUN LA RAZA BAÑA LIMPIA OIDOS UÑAS,81,ESTILISTA CANINA,CLINICA VETERINARIA MARES,54,SERVICIO DE VACUNAS ATENCION MEDICA A ANIMALES Y ESTETICA,1,23005000104742304010311
4,23,005,0001,0474,230401,04,1,1,03,07, 4,413,LICENCIADO EN INFORMATICA,3,2,2,2,1,1,24,2,,,2,1,1,,1,SOPORTE A USUARIOS ASESORIA A USUARIOS INSTALACION Y APLICACION,11,INGENIERO DE SERVICIO,BANCO BANAMEX,52,FACILITAR INGRESOS PERSONALES PRESTAMOS A EMPRESAS ACREDITAR,3,23005000104742304010411
4,23,005,0001,0544,230054,01,1,1,01,02, 4,,,,,,,,,,,,,,,1,,1,REPARTIR CARNE Y SUPERVISAR EN LA CAMIONETA Y ESTAR AL PENDIENTE DE LA,71,SUPERVISOR ENCARGADO DE CARNICERIA,CARNICERIA SAN MARTIN,46,VENTA DE DIFERENTES CARNES PUERCO RES AL PUBLICO LOCAL,2,23005000105442300540111
4,23,005,0001,0544,230054,02,1,1,01,02, 2,,,,,,,,,,,,,,,5,5,,,,,,,,,23005000105442300540211
4,23,005,0001,0544,230054,03,1,1,01,03, 3,,,,,,,,,,,,,,,1,,1,IR A BANCOS HACER DEPOSITOS ENTREGA DE PAQUETES CORRRESPONDENCIA,62,MENSAJERO ADMINISTRATIVO,SERVICIOS CORPORATIVOS DE HOTELES,72,SERVICIO DE HOSPEDAJE TEMPORAL A CLIENTES,2,23005000105442300540311
4,23,005,0001,0544,230054,04,1,1,02,03, 3,,,,,,,,,,,,,,,1,,1,APLICACION DE BOLSAS DE ABATE CHEQUEOS DE PATIOS JARDINES DE CASA EN C,12,BRIGADISTA DE SALUD,S.S.A. SECRETARIA DE SALUBRIDAD,93,REALIZA CAMPAÑAS DE DESCACHARRIZACION LIMPIEZA PROMUEVE LA P,1,23005000105442300540411
4,23,005,0001,0544,230054,05,1,1,01,02, 6,,,,,,,,,,,,,,,1,,1,PREPARACION DE ALIMENTOS PICAR VERDURAS SASONAR GUIZOS,54,AYUDANTE DE COCINA,RESTAURANT BAR FAMILIAR EL DESPACHADOR,72,ELABORACION Y VENTA ALIMENTOS AL MOMENTO,2,23005000105442300540511
4,23,005,0001,0953,230242,01,1,1,03,04, 2,,,,,,,,2,18,1,2,2,,,4,5,,,,,,,,,23005000109532302420111
4,23,005,0001,0953,230242,02,1,1,02,07, 4,393,CONTADOR PUBLICO,3,2,1,1,1,2,22,2,,,2,2,5,5,,,,,,,,,23005000109532302420211
4,23,005,0001,0953,230242,04,1,1,01,07, 4,413,ingeniero en sistemas computacionales,3,2,1,1,1,2,24,2,,,2,1,1,,4,revisa repara cambia piezas de computadoras,11,ingeniero en sistemas,taller de computadoras computec,81,reparacion y venta de refacciones de equipo de computo,2,23005000109532302420411
4,23,005,0001,0968,230225,01,1,1,01,07, 4,373,RELACIONES PUBLICAS Y MERCADOTECNIA,3,2,2,2,1,2,25,2,,,2,1,1,,1,ATENCION AL CLIENTE,12,EJECUTIVA DE CUENTA,TOLDO SIG,54,PUBLICIDAD,1,23005000109682302250111
4,23,005,0001,0968,230225,05,1,1,01,07, 4,374,LICENCIATURA EN DERECHO,3,2,2,2,1,1,23,2,,,1,2,1,,4,"VISITA CLIENTES, REVISA ARCHIVOS VA A JUSGADOS, ELAVORA ACTAS.",11,ABOGADO ASESOR,SIN NOMBRE,54,"ASESORIA FISCALES, JURIDICAS, ADMINISTRATIVAS PARTICULARES.",2,23005000109682302250511
4,23,005,0001,0972,230015,01,1,1,01,08, 1,592,"ADMINISTRACION DE EMPRESAS, ENSEÑANZA",4,2,2,2,1,2,44,2,,,2,2,7,,,,,,,,,,23005000109722300150111
4,23,005,0001,0972,230015,02,1,1,01,06, 3,181,PROFESIONAL TECNICO ASISTENTE EJECUTIVO.,2,,,,,1,20,2,,,1,1,1,,4,TRAMITES ANTE INSTANCIAS DE GOBIERNO Y NOTARIAS PUBLICAS.,62,ASISTENTE EJECUTIVO,SIN NOMBRE,53,CORREDOR BIENES RAICES GESTOR ANTE DIFERENTE INSTAN. DE GOB.,2,23005000109722300150211
4,23,005,0001,0972,230015,03,1,1,01,07, 3,394,TURISMO SUSTENTABLE GESTION HOTELERA,3,2,2,2,1,1,22,1,1,1,,,1,,5,SUPERVISION DE OBRA.,71,PATRON,ESTAMPADOS PENINSULARES,46,"VENTA DE PRODUCTO ESTAMPADO DE CONCRETO, HERRAMIENTAS ACCESO",2,23005000109722300150311
4,23,005,0001,0972,230015,04,1,1,02,05, 4,711,profesor de primaria,2,,,,,2,19,2,,,1,1,5,5,,,,,,,,,23005000109722300150411
4,23,005,0001,103A,230136,01,1,1,01,04, 3,,,,,,,,1,17,2,,,2,1,1,,5,REVISA PIEZAS INSTALA EN REFRIGERADORES LAVADORES AIRES ACON. A DOMICI,12,TECNICO EN REFRIGERACION,TALLER DE REFRIGERACION RICARDO,81,REPARACION DE REFRIGERADORES LAVADORAS AIRES ACOND A DOMICIL,2,230050001103A2301360111
4,23,005,0001,103A,230136,02,1,1,01,04, 1,,,,,,,,1,16,2,,,2,1,1,,1,CHOFER DE AUTOBUS TRANSPORTA TURISMO A DIFERENTES PARTES,55,OPERADOR DE AUTOBUS,TRANSPORTES TENAMAXTLENCES,48,SERVICIO DE TRANSPORTE DE TURISMO EN AUTOBUS DE PASAJEROS A,3,230050001103A2301360211
4,23,005,0001,103A,230136,03,1,1,02,00, 0,,,,,,,,,,,,,,,1,,1,LAVA PLANCHA LIMPIA TRAPEA BARRE SACUDE MUEBLES,82,TRABAJADORA DOMESTICA,SIN NOMBRE,81,SERVICIO DOMESTICO,2,230050001103A2301360311
4,23,005,0001,103A,230136,04,1,1,02,04, 3,,,,,,,,1,18,2,,,2,1,8,5,,,,,,,,,230050001103A2301360411
4,23,005,0001,103A,230136,05,1,1,01,00, 0,,,,,,,,,,,,,,,1,,1,DESTAZAR CARNE DESPACHAR COBRAR LIMPIAR CARNICERIA LAVAR PISO.,52,CARNICERO,CARNICRIA LOS 11 HERMANOS,46,COMERCIO DE CARNE DE RES Y DE CERDO AL MENUDEO AL PUBLICO EN,2,230050001103A2301360511
4,23,005,0001,1171,230008,01,1,1,03,03, 3,,,,,,,,,,,,,,,1,,1,FACTURAR ATENCION A CLIENTES,62,SECRETARIA CAPTURISTA,REFACCIONARIA SIN NOMBRE,46,COMERCIO DE REFACCIONES SIN NOMBRE,2,23005000111712300080111
4,23,005,0001,1171,230008,02,1,1,02,02, 6,,,,,,,,,,,,,,,5,3,6,,,,,,,,23005000111712300080211
4,23,005,0001,1171,230008,03,1,1,02,02, 2,,,,,,,,,,,,,,,5,2,4,QUEHACERES DEL HOGAR LAVA ROPA BARRE TRAPEA SACUDE,82,EMPLEADA DOMESTICA,NO TIENE NOMBRE,81,SERVICIO DE LIMPIEZA DOMESTICA,2,23005000111712300080311
4,23,005,0001,1171,230008,04,1,1,01,04, 3,,,,,,,,1,19,2,,,1,1,1,,1,"CHECAR SALIDA Y ENTRADA DE PERSONAL REVISION DE BOLSAS,MALETAS",83,AGENTE DE SEGURIDAD PRIVADA,AGENCIA DE SEGURIDAD PRIVADA ROYLAN,56,DAR SRVIDIO DE SEGURIDAD PRIVADA A DIFERENTES EMPRESAS O NEG,2,23005000111712300080411
4,23,005,0001,1171,230008,05,1,1,03,04, 3,,,,,,,,1,18,2,,,2,2,1,,1,ATIENDE CLIENTES ENTREGA MODELOS BUSCA PARES LLENA NOTAS DE VENTA,71,VENDEDORA DE ZAPATOS,TIENDA DE ZAPATOS AROS,46,COMERCIO DE ZAPATOS DE PIEL EN LOCAL COMERCIAL,2,23005000111712300080511
4,23,005,0001,1326,230276,02,1,1,03,04, 3,,,,,,,,1,18,2,,,1,2,3,5,,,,,,,,,23005000113262302760211
4,23,005,0001,1326,230276,03,1,1,05,03, 3,,,,,,,,,,,,,,,1,,1,TRAPEAR PISOS LAVAR BAÑOS LIMPIAR MUEBLES ETC.,81,MOSO DE HOTEL,HOTEL PARAISO DE LA BONITA,72,DAR SERVICIO DE HOSPEDAJE A LAS PERSONAS TURISTICAS DE DIFER,2,23005000113262302760311
4,23,005,0001,1326,230276,05,1,1,01,02, 6,,,,,,,,,,,,,,,2,,3,"HACER MEZCLA DE CEMENTO PARA PEGAR BLOCKS, MECETAS, PISOS ETC. CORTE D",52,ALBAÑIL,NOMBRE DEL CONTRATISTA SR. TISIMIN,23,"CONSTRUCCION DE CASAS, TECHOS, MECETAS, BANQUETAS, ETC. DE M",2,23005000113262302760511
4,23,005,0001,1472,230271,01,1,1,01,03, 3,,,,,,,,,,,,,,,1,,5,MANEJA TAXI TRANSPORTA PASAJEROS DE UN LADO A OTRO COBRA HECHA GASLINA,55,DUEÑODE TAXI,NO TIENE NOMBRE,48,DAR SERVICIO DE TRANSPORTE EN TAXI A PASAJEROS,2,23005000114722302710111
4,23,005,0001,1472,230271,02,1,1,02,03, 3,,,,,,,,,,,,,,,5,5,,,,,,,,,23005000114722302710211
4,23,005,0001,1472,230271,03,1,1,02,03, 3,,,,,,,,,,,,,,,5,5,,,,,,,,,23005000114722302710311
4,23,005,0001,1472,230271,04,1,1,01,03, 3,,,,,,,,,,,,,,,1,,1,RONDINES EN DIFERENTES LUGARES QUE LO MANDAN CEBETIS,83,VIGILANTE,RH GUARDIAS BLANCAS,56,PRESTA SERVICIO DE SEGURIDAD A VARIAS EMPRESAS NEGOCIOS,2,23005000114722302710411
4,23,005,0001,1472,230271,05,1,1,01,03, 2,,,,,,,,,,,,,,,1,,1,PRESTA SERVICIO DE TRANSPORTE A PERSONAS,55,TAXISTA,SINDICATO DE TAXISTAS,48,SERVICIO DE TRANSPORTE PARTICULAR A PASAJEROS,2,23005000114722302710511
4,23,005,0001,1487,230019,01,1,1,02,02, 6,,,,,,,,,,,,,,,1,,4,VENDE TIERRA PARA PLANTAS,41,VENDEDORA DE TIERRA,SIN NOMBRE,11,ESCARBA TIERRA DEL MONTE Y LA VENDE EN SACOS,2,23005000114872300190111
4,23,005,0001,1487,230019,03,1,1,02,03, 3,,,,,,,,,,,,,,,5,5,,,,,,,,,23005000114872300190311
4,23,005,0001,1487,230019,04,1,1,02,02, 6,,,,,,,,,,,,,,,5,5,,,,,,,,,23005000114872300190411
4,23,005,0001,1487,230019,05,1,1,01,02, 2,,,,,,,,,,,,,,,1,,3,COLOCACION DE TABLAROCA EN HOTEL,54,AYUDANTE DE TABLAROCA,SIN NOMBRE,23,CONTRATISTA ALBAÑILERIA HERRERIA ELEC. TABLA ROCA ETC.,2,23005000114872300190511
4,23,005,0001,1523,230297,01,1,1,02,06, 2,186,SECRETARIA EJECUTIVA,2,,,,,2,17,2,,,1,2,5,5,,,,,,,,,23005000115232302970111
4,23,005,0001,1523,230297,02,1,1,02,02, 2,,,,,,,,,,,,,,,1,,1,BARRE TIRA BASURA LIMPIA PISOS BAÑOS ESCALERAS,81,EMPLEADA DE LIMPIEZA DE OBRAS NEGRAS,CONSTRUCTORA PUNTA SAM,23,CONSTRUYE EDIFICIOS BARDAS CASAS ETC.,3,23005000115232302970211
4,23,005,0001,1523,230297,03,1,1,02,04, 1,,,,,,,,1,17,2,,,2,2,1,,1,"VIGILA Y RECORRE AREAS DIFERENTES, LLENA REPORTES DIARIOS",83,AGENTE DE SEGURIDAD,HOTEL CASA MAYA,72,DAR SERVICIO DE HOSPEDAJE TEMPORAL A CLIENTES,2,23005000115232302970311
4,23,005,0001,1523,230297,04,1,1,01,03, 3,,,,,,,,,,,,,,,1,,1,PREPARA PLATILLOS GUISADO DE ESPECIALIDADES,52,COCINERO,HOTEL EXCELEST,72,"SERVICIO HOSPEDAR TURISMO INTERNACIONAL,NACIONAL,RESTAURANTE",3,23005000115232302970411
4,23,005,0001,1523,230297,05,1,1,02,02, 6,,,,,,,,,,,,,,,5,5,,,,,,,,,23005000115232302970511
4,23,005,0001,1557,230139,01,1,1,01,03, 3,,,,,,,,,,,,,,,2,,1,CHECA PERSONAL Y LIMPIEZA DE HABITACION,61,SUPERVISORA REVISION A CUARTO,HOTEL IBEROSTAR,72,SERVICIO DE HOSPEDAJE TEMPORAL A CLIENTES,2,23005000115572301390111
4,23,005,0001,1557,230139,03,1,1,01,07, 2,392,ADMINISTRACION DE EMPRESAS,3,1,1,1,1,1,21,2,,,2,1,1,,1,DISTRIBUYE ARTICULOS DE PLAYA EN HOTELES PLAZAS Y AEROPUERTOS,71,REPRESENTANTE DE VENTAS,TOPLINE BLOQUER,43,COMPRA Y VENTA DE ARTICULOS DE PLAYA,2,23005000115572301390311
4,23,005,0001,1557,230139,04,1,1,02,04, 3,,,,,,,,1,17,2,,,1,2,5,5,,,,,,,,,23005000115572301390411
4,23,005,0001,2038,230026,02,1,1,01,04, 3,,,,,,,,1,18,2,,,2,2,1,,1,DIRIGE OPERACIONES ORGANIZA Y PROGRAMA EXCURSIONES Y PERSONAL,21,GERENTE OPERATIVO,TRANSPORTES TURISTICOS DE LUJO,48,VENTA DE PASEOS TURISTICOS A LUGARES ARQUEOLOGICOS Y RESERVA,2,23005000120382300260211
4,23,005,0001,2038,230026,03,1,1,01,04, 2,,,,,,,,1,16,2,,,2,2,1,,4,ELABORA DISEÑA Y VENDE TARJETAS DE PRESENTACION Y PUBLICIDAD,52,VENDEDOR DE TARJETAS DE PRESENTACION Y PU,NO TIENE NOMBRE,54,ELABORACION DESEÑO GRAFICO Y VENTA DE PUBLICIDAD EN TAR,2,23005000120382300260311
4,23,005,0001,2038,230026,04,1,1,01,07, 5,355,LICENCIATURA PSICOLOGIA CLINICA,3,1,1,1,1,2,28,2,,,1,2,1,,4,ATIENDE PACIENTES DIAGNOSTICAS TERAPIAS,11,PSICOLOGO,SIN NOMBRE,62,SERVICIO DE TERAPIAS PSICOLOGICAS EN SU PROPIO DOMICILIO,1,23005000120382300260411
4,23,005,0001,2038,230026,05,1,1,03,03, 3,,,,,,,,,,,,,,,5,5,,,,,,,,,23005000120382300260511
4,24,028,0001,0238,240225,01,1,1,03,07, 2,392,LICENCIADO EN RELACIONES COMERCIALES E INTERNACION,3,2,2,2,1,1,19,1,1,2,,,1,,1,BRINDA SEGURIDAD A PERSONAS EN DISTINTOS EVENTOS SOCIALES COMO BODAS X,83,PERSONAL DE SEGURIDAD,CENTRO POTOSINO DE CONVENCIONES,53,"A REALIZAR EVENTOS SOCIALES COMO XV AÑOS, BODAS, CONFERENCOA",2,24028000102382402250111
4,24,028,0001,0238,240225,02,1,1,01,07, 5,411,INGENIERO CIVIL,3,1,1,1,1,1,29,2,,,2,1,1,,1,PLANEACION REVISION DE DOCUMENTOS PARA OTORGAR LICENCIAS O PERMISOS DE,61,JEFE DE SECCION EN PROTECCION CIVIL,AYUNTAMIENTO DE SAN LUIS POTOSI,93,"SERVICIOS A LA CIUDADANIA OBRAS PUBLICAS, EQUIPAMENTO EN EL",1,24028000102382402250211
4,24,028,0001,0238,240225,03,1,1,01,07, 2,374,LICENCIATURA EN DERECHO,3,1,1,2,1,1,21,2,,,2,2,1,,1,PAGO A PROOVEDORES PAGO DE NOMINAS. CAJA ATENCION A CLIENTE EN AREA AD,62,AUXILIAR ADMINISTRATIVO,"EDMUNDO ZARATE BORBOLLA, S.A. DE C.V.",62,A BRINDAR SERVICIOS MEDICOS A PERSONAS EN UNA CLINICA,2,24028000102382402250311
4,24,028,0001,0238,240225,04,1,1,02,06, 2,186,SECRETARIADO COMERCIAL,2,,,,,2,17,2,,,2,2,1,,1,APOYA EN LA CONTABILIDAD DE UNA EMPRESA,12,AUXILIAR CONTABLE,TELEFONOS DE MEXICO,51,"BRINDAR SERVICIOS DE TELECOMUNICACIONES A PERSONAS, EMPRESAS",1,24028000102382402250411
4,24,028,0001,0238,240225,05,1,1,01,03, 3,,,,,,,,,,,,,,,1,,4,TRANSPORTAR PERSONAS A DISTINTOS LUGARES EN TAXI,55,TAXISTA,NO TIENE NOMBRE,48,A PRESTAR SERVICIO DE TRANSPORTE PUBLICO EN TAXI,2,24028000102382402250511
4,24,028,0001,0350,240050,01,1,1,01,05, 3,409,NORMAL SUPERIOR,2,,,,,1,36,2,,,2,1,6,5,,,,,,,,,24028000103502400500111
4,24,028,0001,0350,240050,02,1,1,02,07, 5,414,INGENIERO ELECTRONICO,3,1,1,1,1,1,33,2,,,1,1,1,,1,IMPARTIR CLASES A ESTUDIANTES A NIVEL UNIVERSITARIO,13,PROFESOR E INVESTIGADOR A NIVEL UNIVERSITARIO,UNIVERSIDAD AUTONOMA DE SAN LUIS POTOSI E INSTITUTO TECNOLOG,61,A LA ENSEÑANZA E IMPARTICION DE CLASES A ESTUDIANTES A NIVEL,1,24028000103502400500211
4,24,028,0001,0350,240050,03,1,2,01,02, 4,,,,,,,,,,,,,,,1,,4,A LA ELABORACION Y VENTA DE MENUDO,81,COMERCIANTE DE ALIMENTOS,FONDA DOS ARBOLITOS,72,A LA ELABORACION Y VENTA DE ALIMENTOS (MENUDOS) EN UN LOCAL,2,24028000103502400500312
4,24,028,0001,0350,240050,03,2,2,01,02, 2,,,,,,,,,,,,,,,1,,4,"HACER LA LIMPIEZA COMO BARRER, TRAPEAR, SACUDIR EN UNA CASA PROPIEDAD",82,EMPLEADA DOMESTICA,TRABAJADOR DOMESTICO,81,"BARRE, TRAPEA, LIMPIA CON ESCOBA, TRAPEADOR UNA CASA PROPIED",2,24028000103502400500322
4,24,028,0001,0350,240050,04,1,1,01,06, 3,186,SECRETARIADO,2,,,,,1,20,2,,,2,2,1,,5,ATENCION Y VENTA DE MEDICAMENTOS AL PUBLICO,71,COMERCIANTE DE MEDICAMENTOS,FARMACIA MEXICO,46,A LA COMPRA-VENTA DE MEDICAMENTOS FARMACEUTICOS EN UNA FARMA,2,24028000103502400500411
4,24,028,0001,0558,240352,01,1,1,01,02, 6,,,,,,,,,,,,,,,8,4,4,REPARACIONES LICUADORAS Y PLANCHAS,52,REPARACION DE APARATOS ELECTRICOS,RADIOTECNICO,81,REPARACION DE APARATOS ELECTRICOS,2,24028000105582403520111
4,24,028,0001,0558,240352,02,1,1,02,07, 5,355,PSICOLOGIA,3,1,1,2,1,1,20,1,1,2,,,1,,1,ORIENTACION EDUCATIVA,13,ORIENTADOR EDUCATIVO,SEGE,61,IMPARTIR EDUCACION,2,24028000105582403520211
4,24,028,0001,0558,240352,03,1,1,02,00, 0,,,,,,,,,,,,,,,1,,1,BARRER TRAPEAR SACUDIR,82,EMPLEADA DOMESTICA,SIN NOMBRE,81,ES UN HOGAR,2,24028000105582403520311
4,24,028,0001,0558,240352,04,1,1,01,03, 1,,,,,,,,,,,,,,,1,,1,LA LIMPIEZA DE OFICINAS,81,MOZO DE OFICINA,SECRETARIA DE DESARROLLO AGROPECUARIO Y RECURSOS HIDRAULICOS,93,APOYAR PROYECTOS PARA LA AGRICULTURA Y GANADERIA,2,24028000105582403520411
4,24,028,0001,0558,240352,05,1,1,01,06, 3,205,ELECTROMECANICA,3,2,1,2,1,2,19,2,,,2,1,1,,4,EMBOBINADO Y REPARACION DE MOTORES ELECTRICOS,12,TECNICO ELECTROMECANICO,REPARACIONES ELECTROMECANICAS,81,REPARAR MOTORES ELECTROMECANICOS,2,24028000105582403520511
4,24,028,0001,0929,240350,01,1,2,01,02, 6,,,,,,,,,,,,,,,1,,1,"BATE TIERRA, ESTIERCOL Y AGUA PARA HACER LADRILLOS CON UN MOLDE",52,LADRILLERO,NO TIENE NOMBRE,32,"ELABORACION Y VENTA DE LADRILLOS, GRAVA, VARILLA ETCC.. EN U",2,24028000109292403500112
4,24,028,0001,0929,240350,01,2,2,03,03, 3,,,,,,,,,,,,,,,1,,1,"HACE LADRILLOS CON LODO, TIERRA AGUA Y CON UN MOLDE",52,LADRILLERO,NO TIENE NOMBRE,32,A LA ELABORACION Y VENTA DE LADRILLOS PARA CONSTRUCCION EN U,2,24028000109292403500122
4,24,028,0001,0929,240350,02,1,1,01,02, 6,,,,,,,,,,,,,,,1,,4,"LEVANTAR BARDAS, REBOCA CON CEMENTO Y LADRILLOS",52,MAESTRO ALBAÑIL,NO TIENE NOMBRE,23,"LEVANTA BARDAS CON MEZCLA, LADRILLOETC.. EN CASA PROPIEDADES",2,24028000109292403500211
4,24,028,0001,0929,240350,05,1,1,02,06, 3,181,ADMINISTRACION DE EMPRESAS,2,,,,,1,21,2,,,2,1,1,,2,PONER GRASA EN ENGRANES CON UNA BROCHA PARA POSTERIORMENTE COLOCARLOS,52,OPERADORA EN UNA FABRICA,"MERCLE, S.A. DE C.V.",33,"FABRICACION DE MOTORES PARA MAQUINAS DE GASOLINAS, REFRESCOS",3,24028000109292403500511
4,24,028,0001,1433,240244,01,1,1,01,02, 6,,,,,,,,,,,,,,,5,1,4,ELABORACION Y VENTA DE ENCHILADAS Y TAMALES,81,COMERCIANTE DE ALIMENTOS,NO TIENE NOMBRE,72,A LA ELABORACION Y VENTA DE ENCHILADAS Y TAMALES EN SU CASA,2,24028000114332402440111
4,24,028,0001,1433,240244,02,1,1,03,02, 6,,,,,,,,,,,,,,,8,5,,,,,,,,,24028000114332402440211
4,24,028,0001,1433,240244,04,1,1,02,06, 4,186,SECRETARIADO,3,1,1,1,1,1,18,2,,,2,1,5,5,,,,,,,,,24028000114332402440411
4,24,028,0001,1537,240242,01,1,1,04,07, 5,355,LIC. PSICOLOGIA,3,2,2,1,2,1,24,2,,,2,2,1,,4,DIAGNOSTICOS E INTERVENCION DE PACIENTES CON PROBLEMAS PSICOLOGICOS,11,PSICOLOGO,CONSULTORIO DE DIAGNOSTICOS,62,DIAGNOSTICA E INTERVIENE A PACIENTES CON PROBLEMAS PSICOLOGI,1,24028000115372402420111
4,24,028,0001,1537,240242,02,1,1,04,07, 3,409,ASISTENTE EDUCATIVO,3,2,2,2,2,2,19,2,,,2,2,1,,1,EDUACADORA DEL AREA MATERNAL,13,EDUCADORA,UN MUNDO PARA BAJITOS,61,IMPARTIR CLASES Y CUIDADO DE BEBES DEL AREA MATERNAL,3,24028000115372402420211
4,24,028,0001,1537,240242,03,1,1,02,07, 5,393,CONTADOR PUBLICO,3,1,1,1,1,1,21,2,,,2,1,1,,4,VENDE ZAPATOS POR CATALOGO,72,VENDEDORA DE ZAPATOS POR CATALOGO,TRABAJADOR INDEPENDIENTE,46,VENTA DE ZAPATOS POR CATALOGO,2,24028000115372402420311
4,24,028,0001,1537,240242,04,1,1,03,00, 0,,,,,,,,,,,,,,,6,5,,,,,,,,,24028000115372402420411
4,24,028,0001,1537,240242,05,1,1,01,07, 5,393,CONTADOR PUBLICO,3,2,2,2,2,1,28,2,,,2,2,1,,1,LA ADMINISTRACION DE UNA EMPRESA,21,ADMINISTRACION DE EMPRESAS,ASOCIACION MEXICANA DE SECRETARIOS DE DESARROLLO ECONOMICO A,93,VINCULACION DE LOS ESTADOS DE LA REPUBLICA MEXICANA Y REACTI,2,24028000115372402420511
4,24,028,0001,1927,240188,01,1,1,02,02, 2,,,,,,,,,,,,,,,1,,1,ACABADOS DE ALBAÑILERIA EN OBRA RUSTICA,52,ALBAÑIL,ARQUITECTO JABOBO COSIO,23,A LA CONSTRUCCION DE CASAS HABITACION Y TODO TIPO DE OBRAS,2,24028000119272401880111
4,24,028,0001,1927,240188,02,1,1,03,02, 6,,,,,,,,,,,,,,,8,1,4,"ELABORA EMPANADAS, GALLETAS Y GELATINAS PARA SU VENTA",52,COMERCIANTE DE ALIMENTOS,NO TIENE NOMBRE,31,"A LA ELABORACION DE EMPANADAS, GALLETAS Y GELATINAS PARA SU",2,24028000119272401880211
4,24,028,0001,1927,240188,03,1,1,01,03, 3,,,,,,,,,,,,,,,5,5,,,,,,,,,24028000119272401880311
4,24,028,0001,1927,240188,04,1,1,02,03, 3,,,,,,,,,,,,,,,1,,4,BARRE TRAPEAR Y LIMPIAR UNA VIVIENDA PROPIEDAD DE OTRO HOGAR,82,EMPLEADA DOMESTICA,TRABAJADOR DOMESTICO,81,"HACER LA LIMPIEZA CON ESCOBA, TRAPEADOR ETC.. EN UNA CASA PR",2,24028000119272401880411
4,24,028,0001,2075,240144,01,1,1,01,03, 3,,,,,,,,,,,,,,,1,,1,"SUPERVISA LAS PRESIONES DEL AIRE, VAPOR Y AGUA EN LE PROCESO DE REFINE",51,SUPERVISOR DE PROCESOS ELECTRONICOS,MINERA MEXICO,21,"SACAR MINERALES COMO ZINC, COBRE, PLATA, ACIDO SULFURICO PAR",2,24028000120752401440111
4,24,028,0001,2075,240144,02,1,1,02,07, 4,394,LICENCIATURA EN GASTRONOMIA,3,2,2,1,2,2,20,1,2,2,,,4,1,4,VENTA DE PELICULAS PIRATAS EN DVD,71,COMERCIANTE DE PELICULAS PIRATAS,NO TIENE NOMBRE,33,A CLONAR PELICULAS EN DISCOS DE DVD CON COMPUTADORA PARA VEN,2,24028000120752401440211
4,24,028,0001,2075,240144,03,1,1,01,04, 3,,,,,,,,2,18,2,,,2,1,1,,4,PREPARACION Y VENTA DE POLLO ROSTIZADO,81,COMERCIANTE DE ALIMENTOS PREPARADOS,ROSTICERIA LA GRANJA,72,A LA PREPARACION Y VENTA DE POLLOS ROSTIZADOS EN UN MERCADO,2,24028000120752401440311
4,24,028,0001,2075,240144,04,1,1,01,02, 2,,,,,,,,,,,,,,,6,5,,,,,,,,,24028000120752401440411
4,24,028,0001,2075,240144,05,1,1,01,03, 3,,,,,,,,,,,,,,,1,,1,ESTAR AL PENDIENTE DE LOS DESPACHADORES DE LAS BOMBAS ETC. EN UNA GASO,71,ENCARGADO DE GASOLINERA,PETROLEOS MEXICANOS (PEMEX),46,"A LA VENTA DE GASOLINA DIESEL , ACEITES ETC. EN UNA GASOLINE",2,24028000120752401440511
4,24,028,0001,2268,240213,01,1,1,02,04, 2,,,,,,,,1,18,2,,,2,2,8,5,,,,,,,,,24028000122682402130111
4,24,028,0001,2268,240213,02,1,1,01,07, 5,331,ING. AGRONOMO FITOTECNISTA,3,1,1,1,1,1,22,2,,,1,1,1,,1,SUPERVISA EL AREA DE PRODUCCION,51,ENCARGADO DE PRODUCTIVIDAD SUPERVISOR,ARCOMETAL,33,"PERFILES, ESTRUCTURAS Y TUBULARES",2,24028000122682402130211
4,24,028,0001,2268,240213,03,1,1,03,04, 2,,,,,,,,1,17,1,2,1,,,8,5,,,,,,,,,24028000122682402130311
4,24,028,0001,2268,240213,04,1,1,01,04, 3,,,,,,,,1,18,1,2,1,,,1,,1,CHOFER TRASLADAR A PERSONAS,55,CHOFER,TASEMACO,81,TALLER DE MAQUINARIA Y PARA CONSTRUCCION,2,24028000122682402130411
4,24,028,0001,2268,240213,05,1,1,02,07, 5,393,CONTADOR PUBLICO,3,2,2,2,1,1,22,2,,,2,2,8,1,4,CONFECCIONAR ROPA PRENDAS PARA MUJER,52,MODISTA,SIN NOMBRE,31,CONFECCIONA ROPA DE MUJER EN UN PEQUEÑO TALLER QUE TIENE ENC,2,24028000122682402130511
4,24,028,0001,2291,240036,01,1,1,02,04, 3,,,,,,,,1,18,2,,,2,2,5,5,,,,,,,,,24028000122912400360111
4,24,028,0001,2291,240036,02,1,1,01,02, 6,,,,,,,,,,,,,,,1,,1,VENDE PAN EMPAQUETADO EN LAS TIENDAS,71,VENDEDOR DE PAN,BIMBO,43,ELABORACION Y VENTA DE PRODUCTOS ALIMENTICIOS,2,24028000122912400360211
4,24,028,0001,2291,240036,03,1,1,03,00, 0,,,,,,,,,,,,,,,1,,3,HACE MEZCLA Y PEGA LADRILLOS,54,PEON DE MANO,CASA PARTICULARES (NO TIENE NOMBRE),23,ELABORACION DE CASAS HABITACION DONDE SOLICITEN SUS SERVICIO,2,24028000122912400360311
4,24,028,0001,2291,240036,04,1,1,02,04, 2,,,,,,,,1,18,2,,,2,2,1,,4,"PAPELERIA, VENTA DE ARTICULOS ESCOLARES Y REGALOS",71,VENDEDORA DE SU PROPIO NEGOCIO,SIN NOMBRE,46,VENTA DE ARTICULOS ESCOLARES Y REGALOS EN UN LOCAL,2,24028000122912400360411
4,24,028,0001,2291,240036,05,1,1,03,04, 2,,,,,,,,1,16,2,,,2,1,1,,4,PINTAR FACHADAS E INTERIORES DE CASAS,52,PINTOR DE FACHADAS E INTERIOR DE CASAS,SIN NOMBRE,23,PINTAR INTERIORES Y FACHADAS DE CASAS,2,24028000122912400360511
4,24,028,0001,2357,240307,01,1,1,01,03, 3,,,,,,,,,,,,,,,1,,1,CHOFER FORANEO,55,CHOFER,AUTOTRANSPORTES BISONTE,48,REPARTIDOR DE POLIETILENO EN UNA FABRICA,2,24028000123572403070111
4,24,028,0001,2357,240307,02,1,1,01,02, 6,,,,,,,,,,,,,,,1,,4,PEPENA FIERRO,72,PEPENADOR,SIN NOMBRE,56,PEPENAR FIERRO EN LA BASURA,2,24028000123572403070211
4,24,028,0001,2357,240307,03,1,1,01,07, 2,413,ING. EN SISTEMAS,3,1,1,1,1,1,22,2,,,2,1,1,,1,SERVIR BEBIDAS Y ALIMENTOS,81,MESERO,LA ANTIGUA,72,CENTRO NOCTURNO,2,24028000123572403070311
4,24,028,0001,2357,240307,04,1,1,02,06, 2,186,SECRETARIADO,2,,,,,2,22,2,,,2,2,1,,2,CHECAR QUE EL PRODUCTO VAYA BIEN EN EL PROCESO DE PRODUCCION,51,ASOCIADA,MEAD WEST VACO CALMAR,33,"PRODUCE Y ELABORA BOMBAS ATOMIZADORAS PARA PERFUMES, CREMAS",3,24028000123572403070411
4,24,028,0001,2357,240307,05,1,1,02,04, 3,,,,,,,,1,18,2,,,1,1,8,1,4,"VENTA DE ARETES, ANILLOS DE FANTASIA",71,VENDEDORA DE TIANGUIS,SIN NOMBRE,46,"VENTA DE ARETES, ANILLOS DE FANTASIA EN LOS TIANGUIS",2,24028000123572403070511
4,24,028,0001,2431,240266,01,1,1,02,07, 5,404,LIC. EN EDUCACION ESPECIAL,3,1,2,1,2,1,23,2,,,2,2,1,,1,IMPARTE CLASES DE PREESCOLAR,13,MAESTRA DE PREESCOLAR,APAC,61,TRABAJAR CON NIÑOS QUE TIENEN PARALISIS CEREBRAL,1,24028000124312402660111
4,24,028,0001,2431,240266,02,1,1,02,06, 3,001,MODISTA,1,,,,,,,,,,,,1,,4,"CONFECCIONA PRENDAS PARA DAMA COMO VESTIDOS, PANTALONES Y BLUSASA",52,MODISTA,SIN NOMBRE,31,CONFECCIONAR PRENDAS DE MUJER,2,24028000124312402660211
4,24,028,0001,2431,240266,03,1,1,02,03, 3,,,,,,,,,,,,,,,8,5,,,,,,,,,24028000124312402660311
4,24,028,0001,2431,240266,04,1,1,02,02, 6,,,,,,,,,,,,,,,8,5,,,,,,,,,24028000124312402660411
4,24,028,0001,2431,240266,05,1,1,01,00, 0,,,,,,,,,,,,,,,1,,4,VENTA DE ROPA USADA,71,VENDEDORA,SIN NOMBRE,46,VENDE ROPA USADA EN TIANGUIS,2,24028000124312402660511
4,24,028,0001,2569,240217,01,1,1,01,07, 5,421,LIC. EN MATEMATICAS,3,1,2,1,1,1,40,2,,,1,1,1,,1,"ADMINISTRATIVO, SUBDIRECTOR, CONTROL DE PERSONAL Y ALUMNOS",21,SUBDIRECTOR,TECNICA 42,61,EDUCACION A NIVEL SECUNDARIA,2,24028000125692402170111
4,24,028,0001,2569,240217,02,1,1,04,07, 1,374,DERECHO,3,2,2,2,2,2,19,1,2,2,,,1,,4,RENTA Y VENTA DE VIDEOJUEGOS EN UN LOCAL,81,RENTA DE VIDEOJUEGOS,RENTA Y VENTA DE XBOX,46,VENDE Y RENTA XBOX EN UN LOCAL,2,24028000125692402170211
4,24,028,0001,2569,240217,05,1,1,01,05, 4,711,MAESTRA DE EDUCACION PRIMARIA,2,,,,,1,19,2,,,2,2,1,,1,MAESTRA PRIMARIA FRENTE A GRUPO,13,MAESTRA,FRANCISCO GONZALEZ BOCANEGRA,61,A LA EDUCACION PRIMARIA,1,24028000125692402170511
4,24,028,0001,2821,240325,02,1,1,01,06, 3,403,LIC. EN EDUCACION,3,1,1,2,1,2,25,2,,,2,2,1,,1,ENSEÑARLES A LOS NIÑOS VALORES REGLAS,13,EDUCADORA,GUARDERIA MI CIUDAD DEL DIF MUNICIPAL,62,ASITENCIA FAMILIAR A PERSONAS DE ESCASOS RECURSOS,2,24028000128212403250211
4,24,028,0001,2821,240325,03,1,1,04,04, 3,,,,,,,,1,18,2,,,2,1,5,5,,,,,,,,,24028000128212403250311
4,24,028,0001,2821,240325,04,1,1,02,03, 3,,,,,,,,,,,,,,,1,,4,"A LA VENTA DE COSMETICOS, PERFUMES ETC.. POR CATALOGO",72,VENDEDORA DE COSMETICOS POR CATALOGO,NO TIENE NOMBRE,46,"A LA COMPRA Y VENTA DE PRODUCTOS DE PERFUMERIA, COSMETICOS E",2,24028000128212403250411
4,24,028,0001,2821,240325,05,1,1,01,02, 6,,,,,,,,,,,,,,,1,,1,"ELABORA FACTURAS, VOLANTES Y TODO TIPO DE PUBLICIDAD IMPRESA EN UNA IM",52,SERIGRAFISTA,"CONTROL FORMAS, S.A. DE C.V.",32,"A LA ELABORACION DE FACTURAS, VOLANTES PUBLICIDAD IMPRESA EN",3,24028000128212403250511
