4,16,053,0001,0240,160290,03,1,1,01,03, 3,,,,,,,,,,,,,,,1,,1,ARCHIVA DOCUMENTOS Y REVISA,62,AUXILIAR ADMINISTRATIVO,OFICIALIA MAYOR GOBIERNO DEL ESTADO,93,CONTROLA LA ADMINISTRACION DEL GASTO DE GOBIERNO EN EL ESTAD,2,16053000102401602900311
4,16,053,0001,0240,160290,04,1,2,01,02, 6,,,,,,,,,,,,,,,1,,1,HACE CORTES DE CARNE PESA Y VENDE AL PUBLICO,52,TABLAJERO,CARNICERIA EL PINO,46,COMPRA VENTA DE CARNE DE MENUDEO,2,16053000102401602900412
4,16,053,0001,0240,160290,04,2,2,03,07, 3,355,PSICOLOGIA,3,1,1,1,1,1,20,1,2,2,,,8,2,1,"CONTESTA TELEFONO RECIBE PACIENTES,ELABORA REGISTRABA NOMBRES",62,RESEPCIONISTA,FUTURA MEDICA,62,"TOMA RAYOS X,ULTRASONIDO,DIAGNOSTICO CLINICO",2,16053000102401602900422
4,16,053,0001,0306,160298,01,1,1,02,07, 3,413,INGENIERIA EN SISTEMAS COMPUTACIONALES,3,2,2,2,1,1,21,2,,,2,1,1,,5,ZAPATERIA ATIENDE AL PUBLICO COMPRA Y VENDE EN UN LOCAL,71,ENCARGADA DE LA ZAPATERIA Y DUEÑA,ZAPATERIA JORJE,46,VENTA DE ZAPATOS AL PUBLICO EN GENERAL,2,16053000103061602980111
4,16,053,0001,0306,160298,02,1,1,01,08, 2,612,ING EN SIDERURGIA CIENCIAS COMPUTACIONALES,4,1,1,1,1,1,44,2,,,2,1,1,,1,DIRECTOR DEL PLANTEL INSTITUTO DE CAPACITACION PARA TRABAJADOR DEL ES-,21,CAPACITADOR DE PEQUEÑAS EMPRESAS,ICADMI,61,CAPACITACION DE PERSONAL A EMPRESAS,2,16053000103061602980211
4,16,053,0001,0306,160298,03,1,1,01,07, 1,374,LEYES,3,2,2,2,1,1,19,2,,,1,2,1,,1,ADMINISTRATIVAS CONTROL Y SUPERVISA ALIMENTOS NATURALES Y ENLATADOS,61,SUPERVISOR ALMACENISTA,CENTRO DE READAPTACION SOCIAL (CERESO),93,ALIMENTOS READAPTACION A INTERNOS,2,16053000103061602980311
4,16,053,0001,0306,160298,05,1,1,02,04, 1,,,,,,,,1,17,2,,,2,2,1,,1,"ELOBORA OFICIOS, SACA COPIAS REVISA DOCUMENTACION DE CORREO LLEVA DOCU",62,AUXILIAR ADMINISTRATIVO,DESARROLLO INTEGRAL PARA LA FAMILIA,62,ASISTENCIA SOCIAL,2,16053000103061602980511
4,16,053,0001,0700,160181,01,1,1,01,02, 5,,,,,,,,,,,,,,,1,,1,"COBRAR, ATENDER Y CHECAR",71,EMPLEADO,ABARROTES LOS CANARIOS,46,VENTA DE ABARROTES,2,16053000107001601810111
4,16,053,0001,0700,160181,02,1,1,01,07, 5,411,INGENIERIA CIVIL,3,2,1,1,1,1,24,2,,,1,1,1,,5,ELABORA PLANOS DE USO HABITACIONAL A EMPRESAS PRIVADAS EN OFICINA,11,INGENIERO CIVIL,CONSTRUCCIONES VILLASEÑOR,54,ELABORA PLANOS Y PROYECTOS DE USO HABITACIONAL A EMPRESAS,2,16053000107001601810211
4,16,053,0001,0700,160181,03,1,1,01,07, 5,332,MEDICO VETERIANARIO Y ZOOTECNISTA,3,1,2,1,1,1,24,2,,,1,2,1,,1,ADMINISTRA LA PARTE FINANCIERA DE UN NEGOCIO,21,GERENTE ADMINISTRATIVO,CASA DE CAMBIO MAJAPARA,52,PRESTA SERVICIO FINANCIEROS AL PUBLICO EN GENERAL EN LAS INS,2,16053000107001601810311
4,16,053,0001,0700,160181,04,1,1,01,04, 3,,,,,,,,2,18,2,,,2,2,5,5,,,,,,,,,16053000107001601810411
4,16,053,0001,0700,160181,05,1,1,02,08, 2,541,OFTALMOLOGIA,4,1,2,1,2,1,28,2,,,2,2,1,,5,ADMINISTRA Y ATIENDE PACIENTES EN GENERAL DENTRO DE UN CONSULTORIO,11,OFTALMOLOGA,KATY OFTALMOLOGIA,62,BRINDA SERVICIOS MEDICOS AL PUBLICO EN GENERAL EN CONSULTORI,2,16053000107001601810511
4,16,053,0001,0927,160081,01,1,1,01,03, 2,,,,,,,,,,,,,,,1,,1,MANEJA Y REPARTIR MEDICAMENTO,71,CHOFER VENDEDOR,NADRO,43,VENDE MEDICAMENTO,3,16053000109271600810111
4,16,053,0001,0927,160081,02,1,1,04,04, 2,,,,,,,,2,18,1,1,1,,,4,5,,,,,,,,,16053000109271600810211
4,16,053,0001,0927,160081,03,1,1,01,02, 4,,,,,,,,,,,,,,,5,5,,,,,,,,,16053000109271600810311
4,16,053,0001,0927,160081,04,1,1,02,07, 3,342,MEDICO CIRUJANO DENTISTA,3,1,2,1,2,1,21,1,2,2,,,4,5,,,,,,,,,16053000109271600810411
4,16,053,0001,0927,160081,05,1,1,01,02, 6,,,,,,,,,,,,,,,8,5,,,,,,,,,16053000109271600810511
4,16,053,0001,0950,160097,01,1,1,02,07, 5,311,ARQUITECTURA,3,2,1,2,1,1,25,1,2,1,,,1,,5,SUPERVISA SEGURIDAD PUBLICA PARA EL GOBIERNO Y SEGURIDAD PRIVADA,83,MANEJO ADMINISTRACION,SERMEX,56,SEGURIDAD,2,16053000109501600970111
4,16,053,0001,0950,160097,02,1,1,01,04, 3,,,,,,,,1,20,2,,,2,2,8,5,,,,,,,,,16053000109501600970211
4,16,053,0001,0950,160097,03,1,1,01,08, 2,601,CIENCIA DE LA EDUCACION,4,2,2,2,2,1,28,2,,,1,2,8,5,,,,,,,,,16053000109501600970311
4,16,053,0001,0950,160097,04,1,1,02,03, 2,,,,,,,,,,,,,,,8,5,,,,,,,,,16053000109501600970411
4,16,053,0001,0950,160097,05,1,1,02,07, 5,393,CONTADOR PUBLICO,3,2,2,2,1,1,25,2,,,2,2,1,,5,"ADMINISTRA SU PROPIO NEGOCIO, LLEVA LA CONTABILIDAD Y BALANCES VENDE",11,CONTADOR PUBLICO,BOUTIQUE DANIELA,46,COMPRA VENTA DE ROPA Y ACCESORIOS POR MENUDEO EN UN LOCAL,2,16053000109501600970511
4,16,053,0001,1037,160035,01,1,1,02,07, 4,355,LICENCIADO EN PSICOLOGIA,3,2,1,1,2,1,24,1,2,2,,,2,,1,EVALUA Y ANALIZA TRAMITES ADMINISTRATIVOS AL PERSONAL QUE LABORA OFICI,12,ANALISTA ADMINISTRATIVO,SECRETARIA DE EDUCACION DEL ESTADO,93,COORDINAR APOYAR Y ASESORAR LOS SERVICIOS DE EDUACACION,1,16053000110371600350111
4,16,053,0001,1037,160035,02,1,1,01,02, 6,,,,,,,,,,,,,,,1,,2,SUPERVISA QUE NO HAYA FUGAS EN LOS GASODUCTOS DE LA PLANTE PEMEX,52,MECANICO DE PISO,PEMEX,32,PRODUCE Y ELABORA PRODUCTOS ENERGETICOS UTILIZADOS PARA COMB,1,16053000110371600350211
4,16,053,0001,1037,160035,03,1,1,08,02, 6,,,,,,,,,,,,,,,5,5,,,,,,,,,16053000110371600350311
4,16,053,0001,1037,160035,04,1,1,01,02, 4,,,,,,,,,,,,,,,2,,3,DESCARGA Y CARGA MATERIALES PARA CONSTRUCCION EN LA INST. DE EMPRESA,81,AYUDANTE GENERAL,MATERIALES SIXTOS Y RUIZ,46,VENDE MATERIALES PARA CONSTRUCCION Y DECORACION DE VIVIENDAS,2,16053000110371600350411
4,16,053,0001,1037,160035,05,1,1,02,06, 3,144,TECNICO EN ENFERMERIA,2,,,,,1,20,2,,,2,2,5,5,,,,,,,,,16053000110371600350511
4,16,053,0001,1111,160413,01,1,1,03,03, 3,,,,,,,,,,,,,,,5,5,,,,,,,,,16053000111111604130111
4,16,053,0001,1111,160413,02,1,1,01,02, 6,,,,,,,,,,,,,,,1,,4,VENDE ROPA PARA DAMA Y CABALLERO EN LOS TIANGUIS DE MORELIA,72,COMERCIANTE AMBULANTE,SIN NOMBRE,46,VENDE ROPA AL MENUDEO PARA DAMA Y CABALLERO EN TIANGUIS,2,16053000111111604130211
4,16,053,0001,1111,160413,03,1,1,01,04, 3,,,,,,,,1,18,1,2,2,,,8,5,,,,,,,,,16053000111111604130311
4,16,053,0001,1111,160413,04,1,1,01,02, 6,,,,,,,,,,,,,,,1,,4,VENDE SERVICIOS ELECTRICO AUTOMOTRIZ AL PUBLICO EN GENERAL SU VIVIENDA,12,TECNICO ELECTRICO AUTOMOTRIZ,TALLER ELECTRICO AUTOMOTRIZ SIN NOMBRE,81,REPARA SERVICIOS ELECTRICOS AUTOMOTRIZ EN EL TALLER,2,16053000111111604130411
4,16,053,0001,1111,160413,05,1,1,01,03, 3,,,,,,,,,,,,,,,1,,1,BARRE Y TRAPEA UNA VIVIENDA AJENA A SU HOGAR,82,TRABAJADOR DOMESTICO,TRABAJADOR DOMESTICO,81,BARER Y TRAPEA UNA VIVIENDA PARTICULAR AJENA A SU HOGAR,2,16053000111111604130511
4,16,053,0001,1179,160086,01,1,1,02,03, 3,,,,,,,,,,,,,,,8,1,4,VENDER PRODUCTOS DE BELLEZA ARTICULOS DE AVON,72,VENDEDORA CASA POR CASA,AVON,46,FABRICA PRODUCTOS DE BELLEZA,2,16053000111791600860111
4,16,053,0001,1179,160086,02,1,1,01,03, 3,,,,,,,,,,,,,,,1,,4,"VENDE ARTICULOS DESECHABLES EN LOS TIANGUIS (VASOS, CUCHARAS)",71,COMERCIANTE DE ARTICULOS DESECHABLE,SIN NOMBRE,46,"COMPRA VENTA DE PRODUCTOS , VASOS Y PLATOS DESECHABLES",2,16053000111791600860211
4,16,053,0001,1179,160086,03,1,1,02,02, 3,,,,,,,,,,,,,,,8,5,,,,,,,,,16053000111791600860311
4,16,053,0001,1179,160086,04,1,1,02,04, 3,,,,,,,,1,18,2,,,2,2,8,5,,,,,,,,,16053000111791600860411
4,16,053,0001,1179,160086,05,1,1,02,06, 3,186,SECRETARIADO,2,,,,,1,17,2,,,1,2,1,,4,ELABORAR PAN PARA SU VENTA DESPACHA Y COBRA,52,PANADERA,NO TIENE,31,ELABORA PAN PARA SU VENTA AL PUBLICO,2,16053000111791600860511
4,16,053,0001,1499,160062,02,1,1,01,04, 3,,,,,,,,1,18,2,,,2,1,1,,4,VENDEDOR A DETALLE,71,VENDEDOR,BOTANAS YURITZI,46,A LA VENTA DE BOTANAS,2,16053000114991600620211
4,16,053,0001,1499,160062,03,1,1,02,07, 5,393,CONTADURIA PUBLICA,3,2,2,2,1,1,24,2,,,2,1,1,,4,ATIENDE UNA PAPELERIA DONDE VENDE ARTICULOS ESCOLARES Y REGALOS,71,DUEÑA PROPIETARIA,PAPELERIA Y REGALOS SHEYLA,46,COMPRA VENTA DE PAPELERIA Y REGALOS EN UN LOCAL,2,16053000114991600620311
4,16,053,0001,1499,160062,05,1,1,01,07, 1,392,ADMINISTRACION DE EMPRESAS,3,2,1,2,1,2,21,1,2,1,,,1,,1,COMPRA MEDICAMENTO PARA EL SEGURO SOCIAL,62,COMPRADOR ESPECIALIZADO,IMSS,62,ATENCION MEDICA Y LA SALUD,1,16053000114991600620511
4,16,053,0001,1499,160258,01,1,1,01,04, 3,,,,,,,,1,19,2,,,2,1,1,,1,SUPERVISA INVENTARIOS DE MOBILIARIOS DE CLINICAS DEL ISSSTE,61,SERVICIOS GENERALES ADMINISTRATIVOS,(ISSSTE),93,AL SERVICIO MEDICO A EMPLEDOS TRABAJADORES DEL ESTADO,2,16053000114991602580111
4,16,053,0001,1499,160258,02,1,1,02,04, 3,,,,,,,,1,18,2,,,2,2,1,,1,"MANEJA ARCHIVOS EN COMPUTADORA, ELABORA OFICIOS Y CONSTESTA TELEFONO",62,SECRETARIA,ORGANIZACION CAMPESINA INSTITUCION PRIVADA,81,APOYO A CAMPESINOS ECONOMICA Y SOCIAL,2,16053000114991602580211
4,16,053,0001,1499,160258,03,1,1,02,07, 4,401,LIC EN EDUCACION PREESCOLAR,3,1,1,2,1,1,23,2,,,1,2,8,5,,,,,,,,,16053000114991602580311
4,16,053,0001,1499,160258,04,1,1,01,07, 5,374,LICENCIATURA EN DERECHO,3,2,2,2,2,1,24,2,,,2,2,8,5,,,,,,,,,16053000114991602580411
4,16,053,0001,1499,160258,05,1,1,02,07, 5,401,LIC EN EDUCACION PREESCOLAR,3,1,1,1,1,1,23,2,,,1,2,1,,1,DOCENTE 2 AÑO DE PREESCOLAR EN COLEGIO PARTICULAR,13,EDUCADORA,CONSERVATORIO DE LAS ROSAS,61,DOCENCIA CUIDA Y ENSEÑA A NIÑOS DE PREESCOLAR,1,16053000114991602580511
4,16,053,0001,1588,160082,01,1,1,05,07, 5,391,LICENCIATURA EN ECONOMIA,3,2,1,2,1,1,24,2,,,2,2,1,,1,SUPERVISA LOS SERVICIOS DE LOGISTICA DE LA CAMPAÑA DE UN PARTIDO POLT.,21,SUPERVISOR DE LOGISTICA,PARTIDO REVOLUCIONARIO INSTITUCIONAL COORDINACION ESTATAL,81,"ADMINISTRAR, COORDINAR Y SUPERVISAR LAS CAMPAÑAS POLITICAS",2,16053000115881600820111
4,16,053,0001,1588,160082,02,1,1,02,03, 1,,,,,,,,,,,,,,,1,,1,BARRE Y TRAPEA UNA VIVIENDA PARTICULAR AJENA A SU HOGAR,82,EMPLEADA DOMESTICA,TRABAJADORA DOMESTICA,81,BARRE Y TRAPEA UNA VIVIENDA PARTICULAR AJENA A SU HOGAR,2,16053000115881600820211
4,16,053,0001,1588,160082,03,1,1,01,03, 3,,,,,,,,,,,,,,,1,,1,CARGAR Y DESCARGAR ABARROTE,62,CARGADOR,ABARROTES LA VIOLETA,46,VENDE ABARROTE AL MENUDEO Y MAYOREO,2,16053000115881600820311
4,16,053,0001,1588,160082,04,1,1,04,07, 2,401,LICENCIATURA A NIVEL PRIMARIA,3,2,1,1,1,2,20,1,2,2,,,4,5,,,,,,,,,16053000115881600820411
4,16,053,0001,1588,160082,05,1,1,01,03, 3,,,,,,,,,,,,,,,1,,4,ATENDER A LOS CLIENTES QUE ENTRAN A COMPRAR,71,ENCARGADO DE NEGOCIO,ABARROTES  PURA MIEL,46,VENTAS DE ABARROTES AL MENUDEO,2,16053000115881600820511
4,16,053,0001,1592,160271,01,1,1,02,03, 1,,,,,,,,,,,,,,,8,5,,,,,,,,,16053000115921602710111
4,16,053,0001,1592,160271,02,1,1,02,06, 1,203,OPERADOR DE PAQUETERIA COMPUTACIONAL,3,1,1,1,1,2,19,2,,,1,2,2,,1,DOCENTE DA CLASES DE COMPUTACION PROGRAMAS BASICOS A NIÑOS PRIMARIA,13,ENCARGADO AULA DE MEDIOS DOCENTES,SECRETARIA DE EDUCACION PUBLICA,93,A LA DOCENCIA EN PRIMARIAS,1,16053000115921602710211
4,16,053,0001,1592,160271,03,1,1,01,02, 5,,,,,,,,,,,,,,,8,5,,,,,,,,,16053000115921602710311
4,16,053,0001,1592,160271,04,1,1,02,03, 3,,,,,,,,,,,,,,,8,5,,,,,,,,,16053000115921602710411
4,16,053,0001,1592,160271,05,1,1,01,02, 6,,,,,,,,,,,,,,,1,,1,CHOFER DE SEGURIDAD PERSONAL AL DUEÑO DE UN HOTEL,83,PERSONA SEGURIDAD PRIVADA AL DUEÑO DE HOTEL,SIN NOMBRE,72,SE DEDICA AL HOSPEDAJE ALOJAMIENTO A TURISTAS Y PUBLICO EN G,2,16053000115921602710511
4,16,053,0001,1925,160050,01,1,1,03,07, 5,413,LICENCIATURA EN SISTEMAS COMPUTACIONALES,3,2,2,2,1,2,25,2,,,2,2,1,,1,"ANALIZA, EVALUA Y CAPTURA TRAMITES PERSONALES DE DEMANDA SOCIAL",12,ANALISTA DE DEMANDA SOCIAL,SECRETARIA AUXILIAR DE GOBIERNO DEL ESTADO,93,BRINDAR SERVICIOS DE DEMANDA SOCIAL A LA CIUDADANIA,2,16053000119251600500111
4,16,053,0001,1925,160050,02,1,1,01,07, 5,355,LICENCIATURA EN PSICOLOGIA EDUCATIVA,3,2,2,2,1,1,24,1,2,2,,,1,,1,CANTA MUSICA VERSATIL EN UN GRUPO MUSICAL DENTRO DE UN BAR,14,CANTANTE DE MUSICA VERSATIL,MUSICO VOCAL THARES DE MORELIA,71,BRINDA SERVICIOS DE MUSICA PARA DIFERENTES EVENTOS SOCIALES,2,16053000119251600500211
4,16,053,0001,1925,160050,03,1,1,01,07, 5,374,LICENCIADO EN DERECHO Y CIENCIAS SOCIALES,3,2,2,2,2,1,25,2,,,2,2,1,,4,VENDE TELEFONOS Y ACCESORIOS PARA CELULARES AL PUBLICO EN UN LOCAL,71,VENDEDORA DE TELEFONOS CELULARES,TELEFONIA DSC,46,VENTA DE TELEFONOS Y ACCESORIOS PARA CELULAR AL PUBLICO,2,16053000119251600500311
4,16,053,0001,1925,160050,04,1,1,02,02, 6,,,,,,,,,,,,,,,5,5,,,,,,,,,16053000119251600500411
4,16,053,0001,1925,160050,05,1,1,05,07, 4,374,LICENCIATURA EN DERECHO Y CIENCIAS SOCIALES,3,2,2,2,2,1,22,1,2,2,,,4,5,,,,,,,,,16053000119251600500511
4,16,053,0001,1925,160074,01,1,1,02,02, 4,,,,,,,,,,,,,,,1,,1,BARRER Y TRAPEAR DENTRO DE UNA VIVIENDA PARTICULAR AJENA A SU HOGAR,82,EMPLADA DOMESTICA,TRABAJADORA DOMESTICA,81,BARRE Y TRAPEA DENTRO DE UNA VIVIENDA PARTICULAR AJENA,2,16053000119251600740111
4,16,053,0001,1925,160074,02,1,1,01,00, 0,,,,,,,,,,,,,,,1,,4,VENDE PRODUCTOS DE ABARROTES AL PUBLICO EN GENERAL DENTRO DE UN LOCAL,71,PROPIETARIA DE TIENDA DE ABARROTES,ABARROTES Y VINOS CALIFORNIA,46,VENTA DE PRODUCTOS DE ABARROTES AL MENUDEO AL PUBLICO,2,16053000119251600740211
4,16,053,0001,1925,160074,03,1,1,01,03, 3,,,,,,,,,,,,,,,6,5,,,,,,,,,16053000119251600740311
4,16,053,0001,1925,160074,04,1,1,02,07, 5,341,MEDICO CIRUJANO PARTERO,3,1,2,1,1,1,23,1,1,2,,,4,5,,,,,,,,,16053000119251600740411
4,16,053,0001,1925,160074,05,1,1,04,04, 3,,,,,,,,1,18,2,,,2,2,5,5,,,,,,,,,16053000119251600740511
4,16,053,0001,2158,160037,01,1,1,02,08, 2,616,INGENIERIA EN TRANSITO Y TRANSPORTE,4,1,1,2,1,1,40,2,,,2,2,1,,4,ASESORAMIENTO TECNICO DE PROYECTOS DE TRANSITO Y VIALIDADES,11,ASESOR TECNICO DE PROYECTOS Y VIALIDADES,HERCAST,54,BRINDA ASESORIA SOBRE PROYECTOS DE TRANSITO Y VIALIDAD,2,16053000121581600370111
4,16,053,0001,2158,160037,02,1,1,02,07, 2,405,EDUCACION FISICA,3,2,1,2,1,1,22,1,2,1,,,4,5,,,,,,,,,16053000121581600370211
4,16,053,0001,2158,160037,03,1,1,02,07, 6,415,INGENIERIA MECANICA,3,1,1,1,1,1,35,2,,,1,1,6,5,,,,,,,,,16053000121581600370311
4,16,053,0001,2158,160037,05,1,1,02,04, 3,,,,,,,,1,19,2,,,2,2,1,,1,VENDE ROPA GENERAL AL MAYOREO Y MENUDEO DENTRO DE UN LOCAL,71,VENDEDORA DE PISO,MAKALY JEANS,46,VENTA DE ROPA EN GENERAL AL MAYOREO Y MENUDEO DENTRO DE LAS,2,16053000121581600370511
4,16,053,0001,2232,160355,04,1,1,01,03, 3,,,,,,,,,,,,,,,1,,1,REPARA MOTORES DE MAQUINARIA AGRICOLA,52,MECANICO,NO TIENE,81,REPARACION DE MAQUINARIA DE MOTORES DE MAQUINARIA AGRICOLA,2,16053000122321603550411
4,16,053,0001,2266,160417,01,1,1,02,03, 3,,,,,,,,,,,,,,,1,,1,HACE CORTE DE PELO O TINTES Y RAYITOS EN UNA ESTETICA Y MASAJES,81,ESTILISTA,ESTRELLA,81,"CORTE DE PELO, TINTES,MANIQUIURE, DEPILACION Y MASAJES",2,16053000122661604170111
4,16,053,0001,2266,160417,02,1,1,02,07, 5,374,DERECHO,3,2,2,2,2,1,23,2,,,2,2,1,,1,"BARRE, LIMPIA Y LAVA Y VA DE COMPRAS AL MERCADO",82,EMPLEADA DOMESTICA,SIN NOMBRE,81,CASA PARTICULAR,2,16053000122661604170211
4,16,053,0001,2266,160417,05,1,1,01,03, 2,,,,,,,,,,,,,,,1,,4,ELABORA Y PREPARA CARNITAS PARA SU VENTA EN LOS TIANGUIS,81,COMERCIANTE DE CARNITAS,NO TIENE NOMBRE,72,COMPRA CARNE DE CERDO Y CUESE LA CARNE PARA CARNITAS Y VENDE,2,16053000122661604170511
4,16,053,0001,2406,160368,01,1,1,02,02, 2,,,,,,,,,,,,,,,5,5,,,,,,,,,16053000124061603680111
4,16,053,0001,2406,160368,02,1,1,02,04, 3,,,,,,,,2,20,2,,,2,2,5,5,,,,,,,,,16053000124061603680211
4,16,053,0001,2406,160368,03,1,1,01,00, 0,,,,,,,,,,,,,,,5,5,,,,,,,,,16053000124061603680311
4,16,053,0001,2406,160368,04,1,1,02,03, 2,,,,,,,,,,,,,,,5,5,,,,,,,,,16053000124061603680411
4,16,053,0001,2406,160368,05,1,1,01,04, 3,,,,,,,,1,18,2,,,2,2,3,5,,,,,,,,,16053000124061603680511
4,16,053,0001,2622,160112,01,1,1,01,02, 3,,,,,,,,,,,,,,,1,,4,ELABORO TORTILLAS ECHAS A MANO Y PREPARO ALIMENTOS PARA VENDER LOCAL,52,COMERCIANTE,NO TIENE NOMBRE,31,PREPARA LA MASA PARA HACER TORTILLAS PREPARA Y VENDE ALIMENT,2,16053000126221601120111
4,16,053,0001,2622,160112,02,1,1,02,03, 3,,,,,,,,,,,,,,,1,,1,"VIGILANCIA,CUSTODIA,CELADORA EN EL CERESO CENTRO DE READAPTACION SOCIA",83,CUSTODIO,CENTRO DE READAPTACION SOCIAL CON  (LIC DAVID FRANCO),93,SALBOGUARDAR LA INSTITUCION DEL CENTRO DE READAPTACION,2,16053000126221601120211
4,16,053,0001,2622,160112,03,1,1,03,07, 5,422,INGENIERIA EN MATERIALES,3,2,1,1,1,1,23,1,2,1,,,8,5,,,,,,,,,16053000126221601120311
4,16,053,0001,2622,160112,04,1,1,01,07, 1,374,DERECHO PENAL,3,2,2,2,1,1,22,2,,,2,1,1,,1,REPARTE INFORMACION DE RESOLUCION DE EDICTOS A FAVOR EN CONTRA DE TRA-,62,ACTUARIO,JUNTA LOCAL DE CONCILIACION Y ARBITRAJE,93,LLEVAN LA LITIGACION DE TRABAJO ENTRE PATRONES Y EMPLEADOS,2,16053000126221601120411
4,16,053,0001,2622,160112,05,1,1,02,07, 5,393,CONTADOR PUBLICO,3,2,2,2,1,1,25,2,,,2,2,1,,1,COBRA IMPUESTOS DE TENENCIA VEHICULAR 2% NOMINA REPECO (IVA),62,CAJERA,GOBIERNO DEL ESTADO,93,RECABA IMPUESTOS RECEPTORIA DE IMPUESTOS,2,16053000126221601120511
4,16,053,0001,2656,160220,01,1,1,01,04, 2,,,,,,,,1,18,2,,,2,2,1,,6,,,,,,,,16053000126561602200111
4,16,053,0001,2656,160220,02,1,1,01,06, 3,204,TECNICO SUPERIOR ELECTRICISTA,3,2,1,2,1,2,23,2,,,2,1,2,,1,"IMPARTE CLASE DE NIVEL SECUNDARIA A ALUMNOS DE 1,2,3 AÑO",13,PROFESOR DE SECUNDARIA,INSTITUTO VASCO DE QUIROGA,61,BRINDA ENSEÑANZA DE NIVEL SECUNDARIA DENTRO DE LAS AULAS,2,16053000126561602200211
4,16,053,0001,2656,160220,03,1,1,01,07, 2,311,ARQUITECTURA,3,2,1,2,1,1,19,2,,,1,1,1,,1,"ADMINISTRA, ANALIZA Y EVALUA LA CARTERA DE CREDITO A LOS CLIENTES",21,GERENTE DE COBRANZA Y CREDITO,GRUPO SALINAS Y BANCO AZTECA,52,SERVICIOS FINANCIEROS A PERSONAS FISICAS Y MORALES EN BANCIO,1,16053000126561602200311
4,16,053,0001,2656,160220,04,1,1,01,07, 5,374,LICENCIATURA EN DERECHO Y CIENCIAS SOCIALES,3,2,2,2,2,1,25,1,2,2,,,1,,1,OTORGA ASESORIAS JURIDICAS EN EL RAMO CIVIL AL PUBLICO EN GENERAL,11,ABOGADA,INSTITUTO MICHOACANO DE LA MUJER,62,PRESTA SERVICIO JURIDICOS AL PUBLICO EN GENERAL EN OFICINAS,2,16053000126561602200411
4,16,053,0001,2656,160220,05,1,1,01,09, 3,596,DOCTORADO EN CIENCIAS Y VENTAS COMERCIALES,5,1,1,1,1,2,33,1,1,2,,,1,,1,ADMINISTRAR Y ASESORA TRAMITES DE COMPRA VENTA DE AUTOS DE AGENCIA,21,GERENTE DE VENTAS AUTOMOTRIZ,AUTOMOTORES LA HUERTA S.A DE C.V,46,COMPRA VENTA DE AUTOS Y REFACCIONES ORIGINALES EN AGENCIA,1,16053000126561602200511
4,16,053,0001,2923,160355,01,1,1,01,03, 3,,,,,,,,,,,,,,,1,,1,CARGA Y DESPACHA ALIMENTOS PREPARADOS PARA ANIMAL A LOS COMPRADORES,71,DEMOSTRADOR DESPACHADOR,PURINA,46,VENTA DE ALIMENTOS PARA ANIMALES PREPARADOS,2,16053000129231603550111
4,16,053,0001,2923,160355,02,1,1,01,02, 6,,,,,,,,,,,,,,,1,,1,ELECTRICIDAD PONE MORETES CON CABLEADO SUBTERRANEO Y MEDIDOR,52,ELECTRICISTA,(IMECA) INGENIERIA MECANICA ELECTRICISTA,23,A PONER CABLES ELECTRICOS EN UNIDADES HABITACIONALES,2,16053000129231603550211
4,16,053,0001,2923,160355,03,1,1,01,03, 1,,,,,,,,,,,,,,,1,,2,HACE TUBERIA PARA LUZ ELECTRICA SUBTERRANEA,52,OBRERO,(IMECA) INGENIERIA MECANICA ELECTRICA,23,CABLEADO DE LUZ EN UNIDADES HABITACIONALES,2,16053000129231603550311
4,16,053,0001,2923,160355,05,1,1,01,02, 4,,,,,,,,,,,,,,,8,5,,,,,,,,,16053000129231603550511
4,17,007,0001,0295,170034,01,1,1,02,07, 3,392,LICENCIATURA ADMINISTRACION,3,2,2,2,1,2,21,2,,,2,2,1,,1,ATENCION A CLIENTES EN UN BANCO,12,EJECUTIVO DE CUENTA,HSBC MEXICO S.A GRUPO FINANCIERA BANCA MULTIPLE,52,SERVICIOS FINANCIERO PERSONALES EN UN BANCO AL PUBLICO EN GE,2,17007000102951700340111
4,17,007,0001,0295,170034,05,1,1,01,07, 4,415,INGENIERO INDUSTRIAL DE SISTEMAS,3,2,1,1,1,2,25,2,,,2,1,3,2,5,ELABORACION DE PROYECTOS DE INVERSION PARA PEQUEÑOS COMERCIANTES,11,PLANEACION DE NEGOCIOS EN EL SECTOR PRIVADO,INGENIERIA POR CUENTA PROPIA,54,PLANEACION DE INVERSION DE NEGOCIOS DE TIPO PRIVADO EN DOMIC,2,17007000102951700340511
4,17,007,0001,0558,170291,01,1,1,09,02, 6,,,,,,,,,,,,,,,1,,1,REALIZA LIMPIEZA EN GENERAL Y LAVA ROPA MANUALMENTE.,82,EMPLEADA DOMESTICA,TRABAJADOR DOMESTICO,81,HOGAR CON TRABAJADORES DOMESTICOS.,2,17007000105581702910111
4,17,007,0001,0558,170291,02,1,1,01,04, 3,,,,,,,,2,18,2,,,2,2,1,,1,"ATIENDE, DESPACHA Y COBRA A LOS CLIENTES",71,EMPLEADA EN TORTILLERIA,"TORTILLERIA ""BEATRIZ""",31,ELABORA TORTILLAS DE MAIZ PARA SU VENTA AL PUBLICO EN GENERA,2,17007000105581702910211
4,17,007,0001,0558,170291,03,1,1,01,04, 3,,,,,,,,1,30,1,2,1,,,6,5,,,,,,,,,17007000105581702910311
4,17,007,0001,0558,170291,04,1,1,01,02, 6,,,,,,,,,,,,,,,1,,1,REPARA AUTOMOVILES DEL CLUTH Y FRENOS MANUALMENTE,52,MECANICO AUTOMOTRIZ ESPECIALISTA EN FRENOS,TALLER MECANICO SIN NOMBRE,81,PRESTAN SERVICIO MECANICO A AUTOMOVILES EN UN TALLER,2,17007000105581702910411
4,17,007,0001,0558,170291,05,1,1,02,02, 6,,,,,,,,,,,,,,,1,,1,COSE PANTALONES DE DAMA CON UNA MAQUINA,52,COSTURERA DE PANTALONES,TALLERES EROM,31,ELABORAN PANTALONES PARA DAMA PARA SU VENTA AL MAYOREO EN UN,1,17007000105581702910511
4,17,007,0001,0685,170406,01,1,1,02,04, 3,,,,,,,,1,18,2,,,2,2,8,1,4,VENDE ROPA DE CASA EN CASA MANUALMENTE,72,COMERCIANTE DE ROPA,EN LA CASA DEL CLIENTE,46,"A LA COMPRA Y VENTA DE ROPA AL PUBLICO EN GENERAL, AMBULANTE",2,17007000106851704060111
4,17,007,0001,0685,170406,02,1,1,01,02, 6,,,,,,,,,,,,,,,6,2,4,COSE ROPA AJENA EN SU HOGAR CON UNA MAQUINA,52,COSTURERA,COSTURERA EN SU HOGAR,31,PRESTA SERVICO DE COSTURA DE ROPA AL PUBLICO EN GENERAL EN S,2,17007000106851704060211
4,17,007,0001,0685,170406,03,1,1,01,03, 3,,,,,,,,,,,,,,,1,,1,CONTROLA ACCESO DEL PUBLICO A LAS OFICINAS,83,VIGILANDO,CONTRALORIA DEL ESTADO DE MORELOS,93,PRESTA SERVICIO DE RECAUDACION Y TESORERIA AL PUBLICO EN GEN,3,17007000106851704060311
4,17,007,0001,0685,170406,04,1,1,01,03, 3,,,,,,,,,,,,,,,1,,1,OPERA UNA MAQUINA INCUBADORA DE POLLO,41,OPERADOR DE MAQUINA INCUBADORA,ENCUBADORA BACHOCCO SA,11,"A LA INCUBACION Y CRIANZA DE POLLO, PARA SU VENTA, EN UNA IN",1,17007000106851704060411
4,17,007,0001,0717,170208,01,1,1,01,04, 3,,,,,,,,1,18,2,,,2,1,1,,4,REPARA INSTALACIONES ELECTRICAS,52,ELECTRICISTA,EN EL DOMICILIO DEL CLIENTE,23,PRESTA SERVICIO DE REPARACION DE INSTALACIONES ELECTRICAS EN,1,17007000107171702080111
4,17,007,0001,0717,170208,02,1,1,01,03, 2,,,,,,,,,,,,,,,8,3,6,,,,,,,,17007000107171702080211
4,17,007,0001,0717,170208,03,1,1,02,05, 4,401,LICENCIADA EN EDUCACION PREESCOLAR,2,,,,,1,19,2,,,2,1,2,,1,DIRIGE Y ORGANIZA LAS ACTIVIDADES DE UN JARDIN DE NIÑOS,21,DIRECTORA DE JARDIN DE NIÑOS,JARDIN DE NIÑOS BERTHA VON GLUMER,61,PRESTA SERVICIOS DE EDUCACION PUBLICA DE NIVEL PREESCOLAR EN,1,17007000107171702080311
4,17,007,0001,0717,170208,04,1,1,04,07, 5,331,INGENIERO AGRONOMO ZOOTENISTA,3,1,1,1,1,1,26,2,,,1,2,1,,1,ADMINISTRA LOS RECURSOS DE UNA GRANJA DE PATOS,21,ADMINISTRADOR DE UNA GRANJA DE PATOS,GRANJA DE PATOS SIN NOMBRE,11,CRIA PATOS PARA SU VENTA AL MENUDEO Y MAYOREO EN UNA GRANJA,2,17007000107171702080411
4,17,007,0001,0717,170208,05,1,1,01,04, 3,,,,,,,,1,19,2,,,2,2,6,5,,,,,,,,,17007000107171702080511
4,17,007,0001,0825,170257,01,1,1,02,06, 3,186,SECRETARIA TAQUIGRAFA,2,,,,,9,99,2,,,9,9,5,5,,,,,,,,,17007000108251702570111
4,17,007,0001,0825,170257,02,1,1,02,04, 3,,,,,,,,2,18,2,,,2,2,1,,1,"ATENDER A USUARIOS, BUSCAR INFORMACION ORIENTARLOS SOBRE EL MANEJO DEL",62,APOYO ADMINISTRATIVO EN SALUD,INSTITUTO NACIONAL DE SALUD PUBLICA,54,A LA INVESTIGACION EN SALUD PUBLICA,1,17007000108251702570211
4,17,007,0001,0825,170257,03,1,1,02,02, 6,,,,,,,,,,,,,,,5,5,,,,,,,,,17007000108251702570311
4,17,007,0001,0825,170257,04,1,1,01,03, 3,,,,,,,,,,,,,,,1,,1,ENTREGO TARJETAS DE CREDITO A DOMICILIO,62,MENSAJERO DE TARJETAS DE CREDITO,SIVA MENSAJERIAS,49,MENSAJERIA Y PAQUETERIA ESTATAL Y NACIONAL,2,17007000108251702570411
4,17,007,0001,1043,170252,01,1,1,01,07, 5,413,LICENCIATURA EN INFORMATICA,3,2,2,2,1,1,38,1,1,2,,,1,,1,A LA CONTRATACION DE PERSONAL EN LA COMISION NACIONAL DE ELECTRICIDAD,21,SECRETARIO DE TRABAJO,COMISION FEDERAL DE ELECTRICIDAD,22,A LA COMERCIALIZACION DE ENERGIA Y A BRINDAR SERVICIO AL PUB,2,17007000110431702520111
4,17,007,0001,1043,170252,02,1,1,01,07, 3,403,PEDAGOGIA LICENCIATURA,3,1,2,2,2,1,31,2,,,1,2,1,,1,CONSULTORA REVISA Y DA ASESORIA A PROGRAMAS EDUCATIVOS,12,CONSULTORA SOBRE EDUCACION,"CONAFE (CONSEJO NACIONAL DE FOMENTO EDUCATIVO,AREA RURAL IND",61,A LA EDUCACION RURAL E INDIGENA,1,17007000110431702520211
4,17,007,0001,1043,170252,03,1,1,03,07, 3,312,DISEÑO INDUSTRIAL,3,1,1,2,1,2,24,1,2,2,,,4,5,,,,,,,,,17007000110431702520311
4,17,007,0001,1109,170366,01,1,1,02,04, 3,,,,,,,,2,19,1,2,2,,,4,5,,,,,,,,,17007000111091703660111
4,17,007,0001,1109,170366,02,1,1,04,07, 4,393,LICENCIATURA EN CONTARUDIA Y FINANZAS,3,2,2,2,1,2,22,2,,,2,2,1,,1,COORDINA LA CONTABILIDAD FISCAL DE UNA OFICINA Y TRABAJOS ADMINISTRATI,11,AUXILIAR CONTABLE,CONCRETOS DE MORELOS SA,32,"ELABORA, DISTRIBUYE Y VENDE CONCRETO PREMEZCLADO A EMPRESAS",2,17007000111091703660211
4,17,007,0001,1109,170366,03,1,1,01,02, 2,,,,,,,,,,,,,,,1,,4,"ADMINISTRA Y DIRIGE UNA GANADERIA, TAMBIEN VENDE Y COBRA EL PAN",51,ADMINISTRADOR DE PANADERA,"PANADERIA ""LA LUZ""",31,ELABORA PAN PARA SU VENTA AL MAYOREO Y MENUDEO AL PUBLICO EN,2,17007000111091703660311
4,17,007,0001,1109,170366,04,1,1,02,04, 3,,,,,,,,1,18,2,,,2,1,1,,5,ADMINISTRA UN TALLER MECANICO,21,ADMINISTRADORA DE TALLER MECANICO,"SERVICIO AUTOMITRIZ ""RODRIGUEZ""",81,PRESTA SERVICIO MECANICO AUTOMOTRIZ AL PUBLICO EN GENERAL EN,2,17007000111091703660411
4,17,007,0001,1109,170366,05,1,1,01,07, 5,415,INGENIERIA MECANICA,3,2,1,2,1,2,25,2,,,1,1,1,,1,ATIENDE A LOS CLIENTES Y VENDE MAQUINARIA CENTRIFUGA,21,GERENTE DE DIVICION EN VENTAS,WESTFALIA SEPARATOR SA,43,A LA DISTRIBUCION Y VENTA DE MAQUINARIA CENTRIFUGA AL MENUDE,2,17007000111091703660511
4,17,007,0001,1151,170347,01,1,1,01,02, 6,,,,,,,,,,,,,,,1,,1,"CONDUCE UN CAMION DE PASAJEROS DEL SERVICIO PUBLICO, Y TAMBIEN COBRA.",55,CHOFER DE AUTOBUS DE PASAJEROS,AUTOBUSES CHAPULTEPEC,48,PRESTAN SERVICIO DE TRANSPORTE PUBLICO DE INTINERARIO FIJO E,2,17007000111511703470111
4,17,007,0001,1151,170347,02,1,1,04,07, 3,392,LICENCIATURA EN DIRECCION Y ADMINISTRACION DE EMPR,3,2,2,2,1,2,25,2,,,2,1,1,,1,ADMINISTRA Y GESTIONA DOCUMENTOS Y ACTIVIDADES EN UN DESPACHO,21,ADMINISTRADOR DE LA EMPRESA,GRUPO ARSALA S.C.,54,PRESTA SERVICIO DE CONSULTORIA ADMINISTRATIVA FINANCIERA Y J,2,17007000111511703470211
4,17,007,0001,1151,170347,03,1,1,01,08, 2,614,INGENIERO EN COMUNICACIONES Y ELECTRONICA,4,2,2,2,1,2,26,2,,,1,2,1,,5,COORDINA LOS PROGRAMAS COMPUTACIONALES Y SISTEMAS,21,DIRECTOR GENERAL Y CREATIVO,ONKLIMAX.COM,56,PRESTA SERVICIOS DE COMPUTO E INTERNET AL PUBLICO EN GENERAL,1,17007000111511703470311
